,name,total_time,ingredients,instructions,servings,category,prep_time,cook_time
38,Chicken &#038; Albanian Salami,PT1H5M,"['Chicken Drumbsticks: 12', 'Red Onion: 1 Diced', 'Onions: 1 Diced', 'Albanian Salami: 10cm Sliced', 'Rosemary: 2 Tbsp', 'Pepper', 'Olive Oil']","['Add a small drizzle of olive oil onto the bottom of a flat casserole dish, I always use a ceramic dish as I find that the ingredients do not stick.\n', 'Add the onions, chicken to the dish, season with pepper and rosemary. Then carefully add the slices of salami in between the chicken drumsticks. If they are placed too close against the dish, they may burn.\n', 'Drizzle olive oil over the top - for an added taste, try using garlic oil.\n', 'Cook in the oven for 1 hour at 180 degrees, turning the chicken half way through.\n', 'A sprinkle of Paprika can be used\xa0to give an extra punch.\n']",4 Servings,,PT5M,PT1H
39,Pite me Spinaq,PT1H15M,"['Filo Pastry: 2 Homemade Discs', 'Spinach: 750g', 'Eggs: 2', 'Feta Cheese: 25g', 'Olive Oil', 'Water: 220ml']","['In a large mixing bowl, with your hands mix together the spinach, eggs and crumble in the cheese. By crunching your hands break up the spinach leafs ensuring all is covered with the egg and cheese. Set to one side.\n', 'Place a filo pastry disc in a large baking tray and add filling on top.\n', 'Add the second disc on top and seal the edges by tucking them down.\n', 'Put a thin layer of oil over the top\n', 'Layer sheets of filo pastry on top of each other brushing a layer of olive oil after each one before the next one is place down. Once 6/8 sheet are laid add the filling on top.\n', 'Repeat the layering until a further 6/8 sheets are on top of the filling - olive oil brushed on each one.\n', 'Put a thin layer of oil over the top.\n', 'Bake in the oven at 180 degrees for 1 hour or until golden brown.\n', 'Once removed from the oven, pour half a cup of water over the top and half a cup of water around the edges. Cover the spinach pie with two tea towels and leave to stand for 1 hour before serving.\n']",12 Servings,,PT15M,PT1H
40,Stuffed Meatballs,PT6H20M,"['Lamb Mince: 500g', 'Parsley: 10g', 'Onions: 1/2 Diced', 'Garlic Powder: 1 Tsp', 'Breadcrumbs: 100g', 'Eggs: 1', 'Milk: 1 Tsp', 'Mozzarella: 100g Cubed', 'Pasta Sauce: 750g - 1000g Jar', 'Salt', 'Pepper']","['Prepare a clean large surface or as I do, work in a large flat dish.\n', 'Flatten the mince out and then scatter the onion, parsley, garlic powder, bread crumbs, salt and pepper over the top.\n', 'Make a little well in the middle and crack the egg into it and add the milk.\n', 'Knead everything together trying to ensure the ingredients are mixed equally, keep kneading until a soft pate is formed into one big pate ball.\n', 'Divide pate into 10 equal balls and roll each one into a rough ball. One at a time, push one piece of mozzarella into the middle and roll again until smooth and ensuring the cheese cannot be seen - completely covered with the pate.\n', 'Add a layer of sauce into the bottom of a slow cooker or a casserole dish, then add the 10 stuffed meatballs on top. Use the last of the sauce to put another layer over the stuffed meatballs ensuring all are covered.\n', 'Cover with a lid and cook for 6 hours high for slow cooking or 3 hours 180 degrees for oven cooking. When oven cooking, check regularly and stir a couple of times.\n']",10 Servings,,PT20M,PT6H
41,Butter Biscuits,PT25M,"['Sugar: 220g', 'Butter: 200g', 'Baking Soda: 1/4 Tsp', 'Flour: 150g', 'Golden Syrup: 1 Tbsp', 'Vanilla Essence: 1 Drop']","['In a large mixing bowl, add the sugar, butter and syrup and mix well into a creamy texture.\n', 'Add the flour, soda and vanilla and fold into the mixture to form a dough. With flour on your hands, break the dough into 12 pieces and roll each one into balls.\n', 'Place the biscuits on a greased / lined baking tray 5cm apart and use the palm of your hand to flatten slightly. Sprinkle them all with some sugar.\n', 'Place in the oven at 180 degree for 12-15 minutes. The butter biscuits should be a light golden and squishy in the middle.\n', 'Leave to firm for 5 minutes before serving.\n']",12 Servings,,PT10M,PT15M
42,Sallatë me Speca të Kuq,PT15M,"['Red Peppers: 2 Cubed', 'Onions: 1 Diced', 'Basil: 5g', 'Pepper', 'Salt', 'Garlic Oil']","['Pour a small amount of Garlic oil into a frying pan and lightly fry the red pepper and onion for 5 minutes.\n', 'Add the salt, pepper and basil - stir well.\n', 'Once the onion starts to brown remove from the heat and put onto a serving dish.\n', 'You can serve the red pepper salad warm or cold.\n']",4 Servings,,PT15M,
43,Lakror me Pras,PT50M,"['Leeks: 3 Large Diced', 'Parsley: 2 Tbsp', 'Salt', 'Pepper', 'Olive Oil: 2 Tbsp', 'Water: 660ml', 'Eggs: 1', 'Flour: 300g']","['Put a little olive oil in a pan and saute the leeks for 5 minutes until softened, then add in the salt, pepper and parsley, stirring well. Take off the heat and leave to cool while making the batter.\n', 'In a mixing bowl, add the flour, egg and 440ml of the water - mix to form a thin batter, similar to a pancake batter texture.\n', 'Use a large / deep baking tray, add a drop of olive oil and rub it over the tray so the base has a coating. Add 3/4 of the batter on top of the oil.\n', 'Next, sprinkle the leek mixture equally over the batter.\n', 'With the remaining batter, add the last 220ml of water mixing well to make a thinner batter and then sprinkle it over the leeks creating a lattice effect.\n', 'Place the leek pie at the bottom of the oven for 30 minutes on 180 degrees, moving it up to the middle for the final 15 minutes. Remove from the oven when golden brown.\n']",12 Servings,,PT10M,PT40M
44,Turkey Calzone Pizza,PT50M,"['Pizza Dough: 2 Ready Rolled', 'Turkey: 4 Handful', 'Aubergines: 1 Diced', 'Courgette: 1 Diced', 'Red Peppers: 1 Diced', 'Green Peppers: 2 Diced', 'Onions: 1 Diced', 'Albanian Salami: 5cm Diced', 'Pizza Sauce: 4 Tbsp', 'Cheddar Cheese: 360g', 'Basil: 1 Tbsp', 'Pepper', 'Olive Oil']","['Cook the Aubergine and courgette for a few minutes in the olive oil before adding the onion, peppers, some basil and pepper. Cook until softened (about 15 minutes).\n', 'Add the Albanian salami and turkey, cooking for a few minutes longer - ensuring all the olive oil has cooked away.\n', 'Take off the heat and add the pizza sauce - stir well.\n', 'While the mixture cools for a few minutes, add a pizza dough to a large foil covered round pizza tray or a baking tray.\n', 'Add half the filling and two handful of cheese on top keeping everything to one side of the dough. Fold the base in half, over the filling to make a semi circle.\n', 'Seal the calzone pizza by folding / twisting the edges together.\n', ""Add the other pizza dough to the tray with half hanging the edge and repeat by folding inwards toward the previous calzone made. You will end up with two calzone pizza's side by side and can be cooked together in one go.\n"", 'Bake in the oven on 180 degrees for 25 minutes or until golden brown.\n']",4 Servings,,PT25M,PT25M
45,Ravani,PT1H,"['Eggs: 2', 'Sugar: 440g', 'Greek Yogurt: 600g', 'Baking Soda: 1 Tsp', 'Flour: 150g', 'Olive Oil']","['In a mixing bowl add the eggs, sugar, yogurt and soda together until a smooth mixture is formed - poor the ingredients into the bowl one at a time with eggs and sugar first. Then add the yogurt and soda onto the yogurt. The soda uses the yogurt to activate therefore by being on the yogurt first, i find that this ensures the rising process for the Ravani begins.\n', 'Add two handfuls of flour and mix, continue to add flour until the mixture has thicken (when dripping some mixture onto of itself it should about 3 seconds to soak back in).\n', 'Using a large baking tray about 2 inches deep, grease it with the olive oil and pour the mixture in - bang the tray down a couple of times to ensure the mixture in flat.\n', 'Place the Ravani into a cold oven, then turn the oven on to 180 degrees and cook for 40 minutes, or until golden brown - the firmness you are looking for should feel like an arm muscle.\n', 'Turn the oven off, leaving the cake inside and door open for 20 minutes.\n', 'Remove from the oven and cut into diamonds, squares or slices and place onto a serving plate.\n', 'Once cooled and cut, boil some sugar and water to form a sugar water and then pour it over the cake. Leave for two hours before serving as a pudding.\n']",12 Servings,,PT10M,PT50M
46,Sallatë të Thjeshtë,PT5M,"['Tomatoes: 2 Sliced', 'Lettuce: 5 Leafs Shedded', 'Onions: 1/4', 'Cucumber: 1/4 Peeled & Sliced', 'Olive Oil: 1 Tbsp', 'Balsamic Vinegar: 1 Tbsp', 'Mayonnaise: 3 Tbsp', 'Salt']","['Place the lettuce into a serving dish and push our from the middle to create a gap in the middle. Sprinkle the onion over the top of the lettuce.\n', 'Lay the tomatoes around in a circle, covering part of the lettuce but also leaving a gap in the middle, then place the cucumber in the gap in a circle pattern.\n', 'Put some mayonnaise in the middle - cover some of the cucumber.\n', 'Season with olive oil, balsamic vinegar and salt.\n']",4 Servings,,PT5M,
47,Byrek me Spinaq,PT40M,"['Filo Pastry: 400g (12 Sheets)', 'Spinach: 750g', 'Eggs: 2', 'Feta Cheese: 25g Crumbled', 'Olive Oil: 4 Tbsp', 'Water: 220ml', 'Basil: 1/2 Tsp Dried']","['Ensure all stalks are cut off the spinach if required and place them into a mixing bowl. Add the two eggs and crumble in the cheese. Mix together so the egg covers all the spinach.\n', 'Take two sheets of pastry, add some of the filling along the long edge leaving about an inch underneath. Fold in both sides about 2 inches, then from the bottom, fold the inch left over the mixture then roll upwards to make a long sausage shape.\n', 'Roll loosely into swirls or fold into horseshoe shapes.\n', 'Repeat steps 2 and 3 creating 6 byrek. Oil the based of a baking dish and place the byrek inside against each other. \n', 'Brush olive oil all over the byrek and sprinkle with basil. Bake in the oven at 180 degrees for 30 minutes or until golden brown.\n', 'If you are not making the byrek for packed lunches, once removed from the oven, pour half a glass of cold water over the top, then half into base of the dish. Cover with two tea towels and leave for 1 hour before serving.\n']",6 Servings,,PT10M,PT30M
48,Tavë me Qepë,PT3H15M,"['Onions: 1 Diced', 'Carrots: 4 Sliced', 'Potatoes: 2 Cubed', 'Beef: 800g', 'Boiling Water: 2 Litres', 'Onion Gravy: 100g', 'Rosemary: 1 Tbsp', 'Salt', 'Pepper', 'Olive Oil']","['Place the carrots, potatoes, onion and beef into a large casserole dish or into your slow cooker.\n', 'Sprinkle over the gravy granules, add the boiling water and mix together until the granules dissolve.\n', 'Season with the salt, pepper and Rosemary and give a final stir.\n', 'Place into the oven on a low shelf, 180 degrees for 2 / 3 hours stirring occasionally. Or, turn the slow cooker up to high for 6 / 8 hours stirring occasionally.\n', 'This Albanian beef and onion stew is ready when the sauce has thickened similar to gravy and the potatoes crumble when touched.\n']",4 Servings,,PT15M,PT3H
49,Macaroni Pasta Bake,PT1H40M,"['Red Peppers: 1 Diced', 'Yellow Pepper: 1 Diced', 'Green Peppers: 1 Diced', 'Onions: 1 Diced', 'Aubergines: 1 Diced', 'Courgette: 1 Diced', 'Albanian Salami: 5cm Diced', 'Garlic: 1 Clove', 'Macaroni Pasta: 250g', 'Vegetable Stock: 1 Litre', 'Basil: 1 Tbsp', 'Salt', 'Pepper', 'Olive Oil']","['Put a pot of water on high heat and bring to the boil.\n', 'While the water is coming to the boil, in another pan, fry the peppers, onion, aubergine and courgette for 3 minutes, until they just start to brown.\n', 'Add salt, pepper, garlic, basil and the chorizo / salami and and continue to fry until the chorizo / salami is starting to brown.\n', 'Add the stock and bring back to a boil. Once boiling turn down the heat and leave to simmer while the pasta cooks.\n', 'Add salt and the macaroni pasta to the boiling water and bring to a simmer. Once the pasta is cooked, drain and add it to the simmering filling pan. Mix all together and remove from the heat.\n', 'You can serve at this point - sprinkle with grated cheese if desired.\n', 'Place into a baking dish, spread evenly and place in the oven at 180 degrees for 20 minutes. Add grated cheese half way through if desired. This will make it into a firm pasta bake.\n']",2 Servings,,PT40M,PT40M
50,Garlic Infused Fish,PT50M,"['Sea Bass Fish: 2', 'Garlic Oil: 4 Tsp', 'Parsley: 2 Tbsp', 'Lemon Juice: 2 Tbsp', 'Salt', 'Pepper', 'Olive Oil: 4 Tsp']","['Take the fish out of the fridge, rinse with cold water before cooking.\n', 'Take 2 sheets of foil the length of the fish plus 4 inches extra each end and lay them out on a flat surface.\n', 'In a bowl, mix the olive oil, garlic, lemon juice pepper, salt and parsley together and brush over the middle of the foil where the fish will sit. \n', 'Place one fish on each foil in the middle and brush the mix over the top and inside.\n', 'Bring the two long edges up to join and fold together, bring the edge up and scrunch together so the seal is tight but forming a lose dome around each fish.\n', 'Place in a baking dish and into the oven at 180 degrees for 45 minutes.\n', 'Switch the oven off but leave the fish inside to continue to steam in the foil dome for another 20 minutes.\n', 'Serve the sea bass in the foil with side salads and breads.\n']",2 Servings,,PT5M,PT45M
51,Speca te Mbushur,PT1H40M,"['Green Peppers: 3', 'Red Peppers: 3', 'Mince Beef: 400g', 'Onions: 3 Diced', 'Rice: 75g', 'Tomato Puree: 40g', 'Basil: 1 Tbsp', 'Rosemary: 1 Tbsp', 'Salt', 'Pepper', 'Olive Oil']","['To create the filling, brown the onions for 2 minutes in some olive oil and on a medium heat before adding the mince beef. Once the beef has browned, add the rosemary, basil, salt, pepper and tomato puree. Add a bit more oil to ensure there is at least 1cm of juice once all ingredients are in the pot.\n', 'Leave to sweat for 10 minutes, then turn off and leave to cool for 15 minutes.\n', 'Once the mixture is cooled, stir in the rice just before you stuff the peppers.\n', 'While the filling is cooling, take out the stalks on the peppers and scoop out the seeds, you can keep the top of the pepper to put back on top after filled, or as i mostly do, discard them.\n', 'Stuff the peppers with the meat mixture ensuring you push some all the way down and is completely full. As each one is done, place into a baking dish. If there is any mixture left, place into the dish around the stuffed peppers.\n', 'Bake in the oven on 180 degrees for 1 hour turning occasionally if desired but not necessary.\n']",6 Servings,,PT40M,PT1H
52,Patëllxhane të Mbushur,PT1H15M,"['Aubergines: 2', 'Red Peppers: 1 Diced', 'Onions: 1 Diced', 'Garlic: 1 Clove', 'Mozzarella: 125g', 'Basil: 2 Tbsp', 'Breadcrumbs: 80g', 'Sage: 1 Tbsp', 'Salt', 'Pepper', 'Olive Oil: 1 Tbsp']","['Cut the Aubergines into half, long ways. Using a knife cut a border into it about 1cm away from the edge to around 2mm from the skin at the bottom, then using a spoon scoop out the Aubergine.\n', ""Add the aubergine that's scooped out into a large pan with the onion, red pepper, garlic and a drizzle of olive oil. sweat for 15 minutes until soft.\n"", 'Once the filling has sweated add the basil, sage and season with salt and pepper and take off the heat.\n', ""While the filling mixture is sweating, place the 4 half's of Aubergine into a dish, season with olive oil, salt and pepper and cover the dish with foil. Place into the oven at 180 degrees for 20 minutes. \n"", ""Take the aubergine half's out of the oven and use the mixture to stuff the them - fill them as much as possible. Add chunks of mozzarella on top and sprinkle 2 tbsp of breadcrumbs per half over the top.\n"", 'Place the stuffed aubergines back in the oven until the mozzarella and breadcrumbs are golden - about 25 minutes. The stuffed Aubergines will be soft and tender.\n', 'You do not need to eat the skin.\xa0 The stuffed aubergines can also be spooned back out and served as a side dish.\n']",4 Servings,,PT30M,PT45M
53,Lamb Chop Bake,PT1H15M,"['Lamb Chops: 12', 'Red Peppers: 1 Diced', 'Green Peppers: 1 Diced', 'Yellow Pepper: 1 Diced', 'Red Onion: 2 Diced', 'Rosemary: 1 Tbsp', 'Salt', 'Pepper', 'Olive Oil']","['In a large casserole dish, cover the base with a drizzle of olive oil so the whole dish is covered.\n', 'Add the lamb chops in first then cover with the peppers and onion. Season with salt, pepper and rosemary\n', 'Place in the oven on 180 degrees for 1 hour turning the chops over plus stirring the peppers and onion after 30 minutes.\n', 'Try adding sliced tomatoes to create a wetter bake. Or extra red or green peppers for a more sweeter / sour taste.\n']",4 Servings,,PT15M,PT1H
54,Tarator,PT5M,"['Greek Yogurt: 900g', 'Cucumber: 1/4 Peeled', 'Garlic Oil: 1 Tsp', 'Olive Oil: 1 Tbsp', 'Mint: 2 Leafs Chopped', 'Salt']","['Homemade yogurt is best to use, but I use Greek or natural yogurt as a base. Mix well the yogurt, cucumber, salt, olive oil, garlic oil (or garlic) together in a bowl.\n', 'Pour into a small pot and chill for 15 Minutes before serving.\n']",6 Servings,,PT5M,
55,Grosh,PT3H10M,"['Cannellini Beans: 250g Dry', 'Boiling Water: 3 - 4 Litres', 'Tomato Puree: 3 Tbsp', 'Onions: 2 Diced', 'Salt: 4 Tbsp', 'Olive Oil']","['Place the beans in a large saucepan (approx 6 litres deep or more) and fill with water. Put onto a high heat and bring to the boil. Add half a teaspoon of salt.\n', 'Once boiling, keep at the boil for the full 3 hours of cooking. Stir occasionally adding a litre of water each time the water reaches a low level (approx every 30 minutes). Add half a teaspoon of salt as well.\n', 'About an hour into the beans boiling, fry the onions in a pan. Once they are starting to brown, add the tomato puree and continue to cook for a further minute. Set aside to cool.\n', 'Once the beans have been boiling for 2 hours, place the onion mixture into the pot and stir.\n', 'For the last 30 minutes, leave the water to boil down until 3 hours is up or you have a thicker consistency (The consistency of Grosh is more liquid like then soup). This should leave about a quarter of the pot filled with the Grosh when finished cooking.\nLeave to cool and serve warm.\n']",4 Servings,,PT10M,PT3H
56,Piqem Mish,PT1H45M,"['Boiling Water: 1 Litre', 'Potatoes: 2 Diced', 'Beef: 500g Diced', 'Onions: 1 Diced', 'Beef Stock: 2 Cubes', 'Tomato Puree: 2 Tbsp', 'Salt', 'Rosemary', 'Olive Oil']","['Brown off the meat and onions for 5 minutes then add them to a large flat casserole dish with the potatoes. Season with salt and dried rosemary.\n', 'Dissolve the stock cubes in the boiling water and add the tomato puree. Mix until all is dissolved then pour over the ingredients in the casserole dish and mix well.\n', 'Place in the oven at 180 degrees for 1.5 hours and mix once, half way through.\n', 'Leave to cool for 5 minutes before serving. Serve in the cooking dish as a one pot dish.\n']",4 Servings,,PT15M,PT1H30M
