,name,total_time,ingredients,instructions,servings,category,prep_time,cook_time
18,Trilece / Tri Leche,PT3H15M,"['Eggs: 6 Large', 'Sugar: 300g', 'Flour: 400g', 'Baking Soda: 2 Tsp', 'Vanilla Essence: 2 Tsp', 'Milk: 1.5 Pints', 'Evaporated Milk: 410g', 'Double Cream: 400g', 'Sugar: 450g', 'Water: 120ml', 'Cornflour: 50g', 'Butter: 240g', 'Salt: 1/2 Tsp']","['Preheat the oven to 180 degrees. Line the bottom of a baking tin with grease proof paper and butter the edges. The best size is 30x20cm and about 6-8cm deep (minimum).\n', 'Split the Eggs into yolks and egg whites and then in a mixing bowl whisk the egg whites until soft white peaks are formed. A good way to test is to turn the bowl upside down to ensure the mixture holds.\n', 'While whisking add the sugar bit by bit until it is all mixed in and the mixture has become a soft, smooth, shiny white texture.\n', 'Whisk in one at a time the egg yolks. The mixture should become yellow/orangish in colour.\n', 'Gently mix in the vanilla essence.\n', 'Sieve the flour and baking soda into the mixing bowl. Fold the mixture quickly but gently until a batter is form - this will be quick thick and sticky.\n', 'Pour into the baking tin and smooth out - tap the tin to help it flatten. Place in the oven for 25 minutes and teh cake should be a golden brown when removed. Place on a cooling rack for 30 minutes and keep the baking tin to one side.\n', 'Once the cake has cooled give the milk, evaporated milk and double cream a quick mix together in a bowl.\n', 'Pierce small wholes all over the bottom of the cake with a skewer. Pour half the milk into the original baking tin and place the cake back in. \n', 'Pierce small wholes all over the top of the cake with a skewer and then pour the rest of the milk over the top. Place the cake in the fridge for 2 hours.\n', 'Pour the sugar into a saucepan and leave to melt over a gentle heat. While melting, mix the cornflour with some water to form a thick mixture and leave to one side. Once the sugar starts to melt you can stir a couple of times. Once it is fully melted, stir gently until it becomes a dark golden brown in colour.\n', 'Remove the melted sugar off the heat and add the water and stir - careful this will spit hot liquid everywhere. I always do this in the garden on an old towel - to do it this way ensure everything is set up so you can get to the towel and back to the heat quickly.\n', 'Place back on the heat and add the butter and cornflour. Mix continuously until the butter is fully melted.\n', 'Add the salt to the caramel and mix for a few more seconds. Pour immediately over the cake and leave to rest for 10 minutes before placing back in the fridge for an hour.\n', 'Before serving, slice the cake into 16 slices and serve in a sallow bowl or plate with rims. As you put your spoon into the cake the milk will squirt out, then the rest of the cake will soak it back in again!\n']",16 Servings,,PT2H50M,PT25M
19,Mish Shqiptar,PT1H35M,"['Lamb Chops: 6 Large', 'Lamb Chops: 18 Small', 'Red Peppers: 1 Diced', 'Beef Tomato: 1 Sliced', 'Parsley: 4g Fresh Diced', 'Salt', 'Pepper', 'Olive Oil']","['In a large deep casserole or baking dish, cover the base with a drizzle of olive oil.\n', 'Add the large lamb chops in first then place the smaller ones around and over the top. Cover with the parsley, then the peppers and lastly Tomato. \n', 'Season with salt, pepper and drizzle another layer of olive oil.\n', 'Place in the oven on the bottom shelf, 180 degrees for 1 hour and 30 minutes. You do not need to turn or mix the chops during cooking but half way, twist the tray 180 degrees to get an even cook. \n', 'Leave to cool for 15 minutes before serving the tray on the table for everyone to help themselves.\n']",6 Servings,,PT5M,PT1H30M
20,Byrek me Kos,PT1H10M,"['Filo Pastry: 6-8 Balls Homemade', 'Olive Oil: 5 Tbsp', 'Eggs: 1', 'Milk: 150ml', 'Greek Yogurt: 350g', 'Feta Cheese: 100g', 'Eggs: 3']","['In a mixing bowl mix together the Yogurt, 3 eggs and feta cheese. Mix well so that all lumps are dissolved.\n', 'Using my homemade filo pastry article, prepare the pastry as required. Use one piece of filo pastry at a time, fold one edge of the circle up by 2 inches creating a straight flat edge.\n', 'Use two sheets of pastry at a time.\n', 'Mix together an egg, the oil and milk to create a thin liquid texture. Brush over each piece of pastry before adding any filling onto it.\n', 'Add some of the filling along the long straight edge leaving about an inch underneath. Fold in both sides about 2 inches, then from the bottom, fold the inch left at the bottom over the mixture then roll upwards to make a long sausage shape.\n', 'In a large oiled baking tray roll the sausage shape into a spiral and place into the middle of the baking tray.\n', 'Repeat until all pastry has been used or the baking tray is full. Ensure that the edges of each one is joined together as tightly as possible. Any left overs can be made into individual batches.\n', 'Place into the oven on 180 degrees for 40 minutes until golden brown. \n', 'Leave to cool before cutting into slices and serving.\n']",8 Servings,,PT30M,PT40M
21,Kurabie,PT30M,"['Flour: 650g', 'Greek Yogurt: 270ml', 'Eggs: 3', 'Sugar: 200g', 'Butter: 120g Melted', 'Baking Soda: 1Tsp', 'Vanilla Essence: 1 Drop', 'Eggs: 1', 'Butter: 10g Melted']","['In a large mixing bowl add all the ingredients and mix together until a dough is formed. The dough should be stick - add extra flour if you find the mixture too sticky to work with.\n', 'Using the extra melted butter, rub some over your hands before breaking the dough into 20 equal sized pieces and roll each piece into a ball. Before rolling each ball rub melted butter over your hands each time.\n', 'Place the balls of dough onto a greased / lined baking tray 5cm apart - you will need to split the balls into two batches cooking one batch at a time.\n', 'Brush eat ball with beaten egg and place in the oven at 180 degree for 20 minutes. The Kurabie will be a light golden colour and slightly squishy in the middle. Place on a cooling rack to cool.\n']",20 Servings,,PT10M,PT20M
22,Sallatë me Speca të Gjelbër,PT35M,"['Green Peppers: 18 Diced Guernica', 'Garlic: 3 Cloves Diced', 'Salt: 1/2 Tsp', 'Pepper: 1/2 Tsp', 'Olive Oil: 2 Tbsp', 'Vinegar: 1 Tbsp']","['On large baking tray with a 1 inch depth, place all the diced pepper.\n', 'Scatter the Garlic, Salt, Pepper and olive oil over the pepper and mix altogether. Ensure the mixture is spread out evenly on the tray.\n', 'Place the baking tray into the oven on 180 degrees for 30 minutes, ensuring you stir half way through.\n', 'Before serving drizzle some vinegar over the top - can be eaten hot or cold.\n']",6 Servings,,PT5M,PT30M
23,Bamje me Mish Qingji,PT35M,"['Okra: 250g', 'Lamb: 400g Diced', 'Onions: 1 Diced', 'Garlic: 2 Cloves', 'Lamb Stock: 500ml', 'Tomato Puree: 2 Tbsp', 'Salt', 'Pepper', 'Olive Oil']","['For homemade, boil the lamb on a high heat in water (with a touch of salt) for 2 hours. Drain the water into a jug through a sieve to separate the meat and stock ready for the recipe.\n', 'Cut just the tip of the stalks off the top of the Okra, ensuring that no holes appear. Wash them in cold water (removing any dirt), pat dry straight away and then lay them spaced out on a baking tray.\n', 'Place in a pre-heated oven at 150 degrees for 10 minutes.\n', 'While the Okra is baking, fry the onions in some olive oil for a few minutes then add the lamb and brown.\n', 'Add the garlic, tomato puree, salt, pepper and then half of the stock. Mix well and simmer for a couple of minutes.\n', 'Lastly, remove the Okra from the oven and add them straight into the pan, including the rest of the stock. Place the lid on and simmer for 20 minutes.\n', 'For the best results, do not lift the lid until the time is up -remove from the heat and leave to stand for a couple of minutes before serving.\n']",2 Servings,,PT15M,PT20M
24,Lakror me Kungull,PT50M,"['Courgette: 6 Grated', 'Eggs: 2', 'Flour: 300g', 'Sugar: 3 Tbsp', 'Baking Soda: 1/4 Tsp', 'Olive Oil']","['In a mixing bowl mix together the grated courgettes, sugar, eggs and baking soda. Add the flour and continue to mix, you are looking for a thick sticky mixture.\n', 'In a large round baking tray (about 2 inches deep) rub some olive oil over the base and edges.\n', 'Scoop the mixture onto the tray and spread out evenly, then pour a small amount of olive oil onto you hand and rub it in circles gently over the top of the mixture. This should flatten it and leave it with a slightly shiny glossing.\n', 'Bake in the oven for 40 minutes on 180 degrees – the top should be a golden brown once cooked.\n', 'Leave to cool before slicing into squares and serving.\n']",12 Servings,,PT10M,PT40M
25,Pule me Oriz,PT1H30M,"['Chicken Drumsticks: 18', 'Paprika: 1 Tbsp', 'Parsley: 1 Tbsp', 'Salt: 1/4 Tsp', 'Pepper: 1/4 Tsp', 'Olive Oil: 2 Tbsp', 'Onions: 1 Diced', 'Butter: 25g', 'Olive Oil: 2 Tbsp', 'Rice: 200g', 'Vegetable Stock: 2 Pints']","['You will need a large deep sided baking tray (I use a traditional Albanian circle tray but you can use anything that is big enough to fit all the chicken). Sprinkle the remaining oil over the base of the tray.\n', 'In a small bowl mix well the paprika, parsley, salt, pepper and half the oil.\n', 'Rub the mix over all the chicken, placing each onto baking tray.\n', 'Place in the oven on the middle shelf, 180 degrees for 30 minutes. \n', 'After 30 minutes remove the chicken from the oven and remove all the chicken out of the tray and keep to one side. These will not be fully cooked yet.\n', 'In a saucepan add the butter, olive oil and onion. Fry for 2-3 minutes until the butter is fully melted and the onion is just starting to brown.\n', 'Add the rice and stir continuously for a minute ensuring the rice is mixed with the onion then add the vegetable stock - be careful as this will spit as you add it to the pan. Bring to the boil.\n', 'Once the rice has come to the boil empty the saucepan into the baking try and stir into the oil and juices left by the chicken,\n', 'Re add all the chicken ensuring there is a bit of space between each one.\n', 'Cover the baking tray with foil and place back in the oven for 40 minutes.\n', 'Once removed from the oven, remove the foil and leave to cool slightly before serving. I serve the tray directly to the table.\n']",6 Servings,,PT10M,PT1H20M
26,Pite me Kungull,PT1H20M,"['Filo Pastry: 400g (12 Sheets)', 'Milk: 300ml', 'Butternut Squash: 500g', 'Eggs: 3', 'Flour: 1 Tbsp', 'Butter: 250g', 'Salt: 1/2 Tsp', 'Water: 220ml']","['In a small saucepan, melt butter then add the squash. Lightly simmer for 30 minutes until the pumpkin has softened. \n', 'Turn off the heat, drain the pumpkin juice through a sieve into a jug and keep to one side. Puree the pumpkin using a hand or small blender - you can also use a fork to crush instead.\n', 'In a mixing bowl mix together 150ml of the milk with the eggs, flour and salt. Add 200ml of the pumpkin juice and mix again. Finally add the pumpkin puree and mix altogether to form the filling. The texture should be a liquid form rather then stodgy.\n', 'Grease a large baking tray with a little olive oil or butter - I use a traditional round Albanian tray, about 30cm wide and 3 inches deep. \n', 'Layer 6 / 7 sheets of the filo pastry on top of each other in the tray - ensure some of the pastry over hangs the edge. Using the other 150ml of milk, dribble each layer with some milk and then use your hands to rub it into the whole sheet of pastry. While I do this I turn the tray slightly for each layer so that there is a full pastry overhang of the whole tray. \n', 'Next, add the pumpkin filling. Layer the remaining sheets of filo pastry over the top using that same method of overhanging the pastry and covering with milk.\n', 'Once all pastry is used, roll the over hanging pastry down to form a crust around the edge of the pie.\n', 'Use any remaining milk to pour over the top of the pie and rub all over.\n', 'Cook the pumpkin pie on 190 degrees for 40 minutes at the lowest tray level of the oven. The top should become dark and crispy once cooked.\n', 'Once cooked remove from the oven and immediately pour the cup of water around the edges and over the top. Cover with a tea towel and leave to cool for 1 hour before serving. The texture should become soft and slightly soggy on the underneath.\n', 'If you find the bottom of the pie too soggy for your taste, you can place back in oven for 10 minutes on 180 degrees to dry out the pastry. Leave to cool before slicing and serving. \n']",12 Servings,,PT40M,PT40M
27,Peshk i Pjekur me Hudhra,PT35M,"['White Fish: 4 Slices', 'Tomatoes: 1 Large Sliced', 'Garlic: 1 Clove Sliced', 'Vegetable Stock: 1 Tbsp', 'Parsley: 10g Finely Chopped', 'Salt', 'Pepper', 'Olive Oil']","['On a casserole tray or dish, layer the tomato equally spaced out using one slice for every piece of fish you have. Depending on the size of fish, one piece should be enough per person (as per recipe) but you may wish to add two as I do if we are not having any sides. Place one or two slices of garlic on top then sprinkle with some dried vegetable stock.\n', 'Place one piece of fish on each tomato base then, on top of the fish, add some more garlic, drizzle olive oil over the top and then season with some more stock, salt, pepper and the parsley.\n', 'Bake in the oven on 180 degrees for 25 minutes, ensure the oven is hot before putting the fish in. I let the baked fish sit in the oven (slightly ajar) for 15 minutes before serving, this allows the fish to cool.\n']",4 Servings,,PT10M,PT25M
28,Tespixhe,PT45M,"['Milk: 220ml', 'Olive Oil: 150ml', 'Flour: 300g', 'Sugar: 3 Tbsp', 'Baking Soda: 1 Tsp', 'Sugar: 220g', 'Water: 440ml']","['Mix together the milk, oil, soda and 3 tablespoons of sugar over a medium heat. Once the mixture starts to bubble, remove from the heat add the flour and mix into a soft dough.\n', 'Grease with Oil a baking tray (traditionally a circle tray is used) - about 30cm is best and then roll the dough around the tray to give a smooth texture then press the dough into the tray. Be sure to get into all the edge and the best thickness is just less then 1cm - equally across the whole tray.\n', 'Traditionally triangle and dot patterns are pressed into the dough - not all the way through but deep. I like to experiment here to give my Albanian Tespixhe my own personal touch.\n', 'Bake in the oven on 180 degrees until golden - around 25 minutes\n', 'While baking, make the sugar water by mixing the water and cup of sugar together over a medium heat. Once boiling and the water is dissolved remove from the heat to cool. Once you remove the Tespixhe form the oven, cover with the sugar water. You want enough to completely cover and about 1cm up the tray to soak into the baked dough while cooling.\nOnce cool, refrigerate for at least an hour before serving.\n']",12 Servings,,PT20M,PT25M
29,Bakllava me Mjaltë,PT2H,"['Filo Pastry: (1200g) 36 Sheets', 'Walnuts: 500g', 'Melted Butter: 200g', 'Ground Cinnamon: 1 Tsp', 'Sugar: 220g', 'Water: 220ml', 'Honey: 165g']","['This syrup can cool while your Baklava is cooking. Add the honey, water and sugar into a saucepan and bring to a boil while continuously stirring. Once the sugar has melted, leave to boil on a medium heat for 5 minutes and then move to one side to cool.\n', 'Mix the ground walnuts and cinnamon together and set aside.\n', 'Measure your filo pastry ready for the Baklava verses the size of baking tray being used - you will need a size that is about 30cm x 20cm and 6cm deep, cut the filo pastry to size and cover with a damp tea towel to keep the pastry moist.\n', 'Brush some melted butter onto the based a sides of the baking tray. Lay one sheet of filo pastry at a time buttering each one as you go, layer 8 sheets. Mix the ground walnuts and cinnamon together and sprinkle 1/4 over the pastry.\nLayer 4 more sheets buttering each one as you go and then add another 1/4 of the nut mixture - repeat so you have 4 layers on the nut mixture. Layer the last 8 sheets of filo pastry - again, buttering as you go finishing the top layer of pastry with a coat of butter too.\nYou can cut the Baklava any way you desire, the traditional is diamonds. Cut 3 lines making 4 rows down the length of the tray. Then cut diagonally across to make diamonds.\n', 'Place in the oven at 160 degrees and cook for 1 hour and 15 minutes. Check every 5 minutes after 1 hour to ensure cooked, leave slightly longer if required and take out when the pastry is golden and crispy.\n', 'Pour the syrup over the Baklava straight away while it is still hot - you should here the sizzling. Leave to set for 4 hours - allowing the syrup to soak through the pastry before serving.\n']",15 Servings,,PT45M,PT1H15M
30,Egg Bake,PT55M,"['Eggs: 8', 'Milk: 220ml', 'Spinach: 200g', 'Red Peppers: 1 Diced', 'Onions: 1 Diced', 'Cheddar Cheese: 180g', 'Potatoes: 4 Skinned, Half & Boiled', 'Salt', 'Pepper', 'Olive Oil']","['Saute the onion and red pepper until soft, this should take around 5 Minutes. Set aside to cool.\n', 'Beat the eggs and milk in a bowl until fully mixed, add the cheese, season with salt and pepper, then add the cooled onion and pepper. Mix all the ingredients together well.\n', 'Place the potato into the base of a greased casserole dish, then the spinach and poor the egg mixture over the top (give the mixture another quick mix before pouring).\n', 'Bake in oven on 180 degrees for 40 minutes or until golden and cooked through creating the egg & potato bake.\n']",6 Servings,,PT15M,PT40M
31,Tave Dheu,PT1H,"['Liver: 500g Diced', 'Garlic: 2 Cloves Minced', 'Red Bell Peppers: 5 Roasted & Diced', 'Tomatoes: 6 Diced', 'Feta Cheese: 100g', 'Ricotta: 200g', 'Chilli Flakes: 1 Tsp', 'Flour: 40g', 'Bay Leafs: 4', 'Water: 220ml Hot', 'Pepper', 'Salt', 'Olive Oil']","['Firstly, brown the liver for a few minutes in olive oil, remove from the pan and set aside for later.\n', 'Add the garlic into the remaining oil and sauté for 2 minutes before adding the red peppers and tomatoes then continue to saute on a medium heat for 5 minutes.\n', 'Add the flour while stirring continuously, then add in the feta and ricotta cheese. Continue stirring for a few minutes before adding the bay leaves, water and liver.\n', 'This is the best time to season to taste with chilli flakes, salt and pepper - then leave to cook together for 5 minutes.\n', 'Split the mixture into 4 clay dishes and cook on 200 degrees for 25 minutes. Serve the Albanian Tave Dheu while hot and bubbling.\n']",4 Servings,,PT30M,PT30M
32,Byrek me Djathë dhe Spinaq,PT40M,"['Filo Pastry: 400g (12 Sheets)', 'Spinach: 200g', 'Eggs: 2', 'Cheddar Cheese: 180g', 'Cream Cheese: 25g', 'Olive Oil: 4 Tbsp', 'Water: 220ml', 'Basil: 1/2 Tsp Dried']","['Ensure all stalks are cut off the spinach and place into a mixing bowl. Add the eggs and cheeses. Mix together so the egg covers all the spinach.\n', 'Take two sheets of pastry, add some of the filling along the long edge leaving about an inch underneath. Fold in both sides about 2 inches, then from the bottom, fold the inch left over the mixture then roll upwards to make a long sausage shape.\n', 'Roll loosely into swirls or fold into horseshoe shapes.\n', 'Repeat steps 2 and 3 creating 6 byrek. Oil the based of a baking dish and place the byrek inside against each other. \n', 'Brush olive oil all over the byrek and sprinkle with basil. Bake in the oven at 180 degrees for 30 minutes or until golden brown.\n', 'If you are not making the byrek for packed lunches, once removed from the oven, pour half a glass of cold water over the top, then half into base of the dish. Cover with two tea towels and leave for 1 hour before serving.\n']",6 Servings,,PT10M,PT30M
33,Meatball Bake with Roast Potatoes,PT1H10M,"['Meatballs: 20', 'New Potatoes: 500g Quartered', 'Red Peppers: 1 Diced', 'Red Onion: 1 Sliced', 'Cherry Tomatoes: 15', 'Basil: 10g', 'Parsley: 10g', 'Chilli Flakes: 1/2 Tsp', 'Salt', 'Pepper', 'Olive Oil']","[""You'll need to start with the potatoes as they need slightly longer - while these are pre cooking, you can slice and dice the rest of your ingredients. Drizzle some olive oil in the bottom of a casserole dish - about 30cm x 15cm and then place the quartered potatoes in. Shake and place in a preheated oven of 180 degrees.\n"", 'Take out the potatoes after 20 minutes, toss and turn them before you add the rest of your ingredients. \n', 'Add the meatballs, red pepper, red onion, cherry tomatoes, chilli flakes, basil and parsley. Drizzle another layer of olive oil and season well with salt and pepper. Give the meatball bake a big stir, mix and ensure the ingredients are equally spread out over the dish.\n', 'Place in the oven for 40 minutes, given another mix after the first 20 minutes. The potatoes will brown and crisp, while the meatballs cook remaining soft.\n']",2 Servings,,PT10M,PT1H
34,Meat Lasagna with Vegetables,PT1H10M,"['Lasagna Sheets: 6', 'Red Lasagna Sauce: 500g', 'White Lasagna Sauce: 500g', 'Mince Beef: 400g', 'Onions: 1 Diced', 'Spinach: 100g', 'Red Peppers: 1 Diced', 'Mozzarella: 100g Cubed', 'Cheddar Cheese: 180g', 'Basil: 2 Tbsp', 'Olive Oil']","['Add the mince into a frying pan with a small amount of olive oil over a medium heat. Once browned, remove from the heat and drain any excess oil before placing back in the pan.\n', 'Add the red sauce (do this off the heat) and mix in well.\n', 'In a large casserole dish (approx. 30cm by 15cm and 5cm deep or more) place a small amount of the mince, onion and red pepper - it does not need to cover the whole base, just enough to hold the first layer of pasta off the bottom.\n', 'Lay 2 sheets of pasta, if possible keep them slightly away from the edges of the dish.\n', 'Place two spoons of white sauce and spread so that it covers the pasta and the gap to the edges. If you do not have white sauce use two spoons of greek yogurt instead.\n', 'Add half of the left over mince first and spread evenly, then layer half the onion, red pepper and mozzarella even across the dish. Place the spinach on top followed by 2 sheets of pasta and white sauce.\n', 'Add the last of the mince, spread evenly, with the last of the onion, red pepper and mozzarella.\n', 'Finish the layering with 2 more sheets of pasta and a coating of the white sauce.\n', 'For the topping, sprinkle the cheddar cheese over the white sauce, then the basil.\n', 'Bake in the oven on 180 degrees for 40 minutes or until the cheese golden brown and bubbling.\n']",6 Servings,,PT30M,PT40M
35,Fergese,PT1H,"['Red Bell Peppers: 5 Roasted & Diced', 'Onions: 1 Diced', 'Feta Cheese: 150g', 'Tomatoes: 400g Diced', 'Chilli Flakes: 1 Tsp', 'Flour: 20g', 'Butter: 20g', 'Greek Yogurt: 40g', 'Basil: 2 Tbsp', 'Pepper', 'Salt', 'Olive Oil']","['Sweat the onion in a small drop of olive oil until softened - about 3 minutes, then remove and set aside.\n', 'Simmer the red bell peppers, tomatoes and basil on a medium to high heat for 10 minutes - the mixture should have thickened with little liquid remaining. Mix in the onion and set aside to cool.\n', 'In a separate small saucepan melt the butter. Mix in the flour to form a roux. Crumble in the feta while stirring quickly. Once all has melted, you should have a thick texture - add the yogurt.\n', 'Mix the feta and yogurt mixture into it into the pepper and tomatoes mixture. Season with the Chilli flakes, salt and pepper.\n', 'Split into 2 dishes and cook on 180 degrees for 30 minutes. Leave to cool slightly before serving - best served with crusty bread.\n']",2 Servings,,PT30M,PT30M
36,Turkey Stuffed Peppers,PT1H40M,"['Red Peppers: 3', 'Green Peppers: 3', 'Turkey: 6 Handfuls', 'Rice: 75g', 'Tomato Puree: 40g', 'Onions: 3 Diced', 'Rosemary: 1 Tbsp', 'Basil: 1 Tbsp', 'Salt', 'Pepper', 'Olive Oil']","['Start off with a hot frying pay and brown the onions for 2 minutes in some olive oil. Add the rosemary, basil, salt, pepper and tomato puree - cooking together for a few minutes.\n', 'Add the turkey (broken into chunks or diced) and stir well.\n', 'You need to ensure there is at least 1cm of juice once all ingredients are in the pot, add a little olive oil to top up the level and then leave to sweat n a medium heat for 10 minutes.\n', 'Turn off and leave to cool for 15 minutes.\n', 'Once the turkey mixture is cooled, stir in the rice just before you stuff the peppers.\n', 'Stuff the peppers with the mixture ensuring you push some all the way down and each one is completely full. As each one is done, place into a casserole dish. If there is any mixture left, place into the dish around the stuffed peppers.\n', 'Bake in the oven on 180 degrees for 1 hour turning occasionally if desired \n']",6 Servings,,PT40M,PT1H
37,Byrek me Djathë,PT40M,"['Filo Pastry: 400g (12 Sheets)', 'Eggs: 2', 'Cottage Cheese: 300g', 'Feta Cheese: 50g Crumbled', 'Olive Oil: 4 Tbsp', 'Water: 220ml', 'Basil: 1/2 Tsp Dried']","['In a mixing bowl, combine and mix well the cottage cheese, eggs and feta until a thick mixture is formed.\n', 'Using four sheets at a time layered, add some of the cheese mixture into the middle, you can fold into any shape, I like to make squares.\nTo fold into a square, take the bottom right corner and fold upwards, fold the left hand side over the corner folder up, then fold down from the top.\n', 'Repeat step 2 creating 6 cheese byrek. Oil the based of a baking dish and place the cheese byrek inside. Brush olive oil all over them and sprinkle with basil.\n', 'Bake in the oven at 180 degrees for 30 minutes or until golden brown.\n', 'If you are not making the byrek for packed lunches, once removed from the oven, pour half a glass of cold water over the top, then half into base of the dish. Cover with two tea towels and leave for 1 hour before serving.\n']",6 Servings,,PT10M,PT30M
