,name,total_time,ingredients,instructions,servings,category,prep_time,cook_time
94,Бешбармак из фарша,PT90M,"['Лапша                                \xa0—\xa0200\xa0Грамм', 'Фарш                                \xa0—\xa0400\xa0Грамм', 'Сметана                                \xa0—\xa050-70\xa0Грамм', 'Луковица                                \xa0—\xa02\xa0Штуки', 'Морковь                                \xa0—\xa01\xa0Штука', 'Помидор                                \xa0—\xa01-2\xa0Штук', 'Сыр                                \xa0—\xa0150-200\xa0Грамм', 'Соль, специи, растительное масло                                \xa0—\xa0По вкусу']","['\n                                            ', '                                                    ', '\n                            ', '\n                            ', '1. Жаропрочную форму смажьте растительным маслом, можно присыпать горстью панировочным сухарей. Лапшу для бешбармака отварите и выложите ровным слоем в форме. ', '\n                                                ', '\n                                                                    ', '                                                    ', '\n                            ', '\n                            ', '2. Немного лука нарежьте и выложите сверху. ', '\n                                                ', '\n                                                                    ', '                                                    ', '\n                            ', '\n                            ', '3. Остальной лук с чесноком и мясом пропустите через мясорубку. Выложите фарш на сковороду с разогретым растительным маслом, обжарьте минут 7-10 и переложите в форму. Подсолите фарш по вкусу и добавьте специи при желании. ', '\n                                                ', '\n                                                                    ', '                                                    ', '\n                            ', '\n                            ', '4. Чуть-чуть тертой моркови. ', '\n                                                ', '\n                                                                    ', '                                                    ', '\n                            ', '\n                            ', '5. И тонкие ломтики помидора. ', '\n                                                ', '\n                                                                    ', '                                                    ', '\n                            ', '\n                            ', '6. Сметану соедините с небольшим количеством воды, добавьте щепотку соли и перемешайте. Вылейте в форму. ', '\n                                                ', '\n                                                                    ', '                                                    ', '\n                            ', '\n                            ', '7. Осталось только присыпать тертым сыром и отправить бешбармак из фарша в разогретую до 180 градусов духовку. ', '\n                                                ', '\n                                                                    ', '                                                    ', '\n                            ', '\n                            ', '8. Запекайте до готовности. \r\nПриятного аппетита!', '\n                                                ', '\n                                                            ']",Количество порций: 6-8,Мясо / Фарш / Лапша,PT0M,PT90M
95,Токаш (лепешка),PT60M,"['Мука                                \xa0—\xa02\xa0Стакана\xa0(объёмом 200 мл.)', 'Дрожжи сухие                                \xa0—\xa01\xa0Чайная ложка', 'Соль                                \xa0—\xa01/2\xa0Чайных ложки', 'Вода                                \xa0—\xa0170\xa0Миллилитров', 'Масло растительное                                \xa0—\xa02\xa0Ст. ложки']","['\n                                            ', '                                                    ', '\n                            ', '\n                            ', 'Нам понадобятся: мука, дрожжи, вода, соль и растительное масло для смазки рук.', '\n                                                ', '\n                                                                    ', '                                                    ', '\n                            ', '\n                            ', 'Муку просейте, сделайте в центре углубление, куда добавьте дрожжи, теплую воду и соль. Руки смажьте растительным маслом, замесите теперь кислое тесто. Накройте его полотенцем и оставьте в теплом месте на 30 минут для подъема. ', '\n                                                ', '\n                                                                    ', '                                                    ', '\n                            ', '\n                            ', 'Разогрейте духовку до 180 градусов. Тесто разделите на 4 равные части, каждую из которых окуните в муку (обваляйте их в ней). Из каждой части теста сформируйте руками лепешку. В середине лепешки сделайте (пальцами) углубление, наколите его вилкой. Смажьте маслом противень, выложите на него лепешки. Выпекайте их до готовности (примерно 20 минут).', '\n                                                ', '\n                                                                    ', '                                                    ', '\n                            ', '\n                            ', 'Остудите лепешки под полотенцем, подавайте их к столу. Приятного аппетита!', '\n                                                ', '\n                                                            ']",Количество порций: 4,Тесто / Дрожжевое тесто / Постное тесто,PT0M,PT60M
96,Шельпек,PT40M,"['Мука пшеничная                                 \xa0—\xa02,75-3\xa0Стакана', 'Вода                                 \xa0—\xa0200\xa0Миллилитров', 'Соль                                 \xa0—\xa01\xa0Чайная ложка', 'Масло растительное                                 \xa0—\xa0По вкусу\xa0(для обжарки)']","['\n                                            ', '                                                    ', '\n                            ', '\n                            ', 'Прежде всего, нам необходимо замесить тесто, соединив все ингредиенты. Оно должно получиться густым и плотным. Затем даем тесту постоят буквально 10 минут. ', '\n                                                ', '\n                                                                    ', '                                                    ', '\n                            ', '\n                            ', 'Теперь делим тесто на 7-9 равных частей. ', '\n                                                ', '\n                                                                    ', '                                                    ', '\n                            ', '\n                            ', 'Каждую часть мы раскатываем в очень тонкую лепешку толщиной примерно 2-3 миллиметра. ', '\n                                                ', '\n                                                                    ', '                                                    ', '\n                            ', '\n                            ', 'Для обжаривания нам понадобиться сковорода с толстыми стенками. Наливаем в нее растительное масло (примерно 1,5-2 сантиметра) и хорошенько его нагреваем. В кипящее масло выкладываем лепешку и обжариваем ее примерно 3-4 секунды, вращая ее по кругу при помощи вилки.', '\n                                                ', '\n                                                                    ', '                                                    ', '\n                            ', '\n                            ', 'Затем переворачиваем и так же обжариваем 3-4 секунды. ', '\n                                                ', '\n                                                                    ', '                                                    ', '\n                            ', '\n                            ', 'Готовую лепешку выкладываем на бумажную салфетку. То же самое повторяем со всеми оставшимися лепешками. Шельпеки готовы, приятного вам аппетита!', '\n                                                ', '\n                                                            ']",Количество порций: 7-9,Тесто,PT0M,PT40M
97,Куырдак с картофелем,PT120M,"['Легкое говяжье                                \xa0—\xa01\xa0Штука', 'Печень говяжья                                \xa0—\xa01/2\xa0Штуки', 'Сердце говяжье                                \xa0—\xa01/2\xa0Штуки', 'Курдючное сало                                \xa0—\xa0200\xa0Грамм', 'Картофель                                \xa0—\xa04\xa0Штуки', 'Лук                                \xa0—\xa02\xa0Штуки', 'Говяжий бульон                                \xa0—\xa02\xa0Стакана', 'Лавровый лист                                \xa0—\xa02\xa0Штуки', 'Соль                                \xa0—\xa0По вкусу', 'Перец                                \xa0—\xa0По вкусу', 'Зелень                                \xa0—\xa0По вкусу']","['\n                                            ', '                                                    ', '\n                            ', '\n                            ', 'Нарезаем мясо,картошку и лук мелкими кубиками. Курдюк тоже измельчаем. ', '\n                                                ', '\n                                                                    ', '                                                    ', '\n                            ', '\n                            ', 'Растапливаем жир, избавляемся от шварок. ', '\n                                                ', '\n                                                                    ', '                                                    ', '\n                            ', '\n                            ', 'По очереди жарим в казане легкое 15 минут, потом сердце 15 минут, потом печень 10 минут. ', '\n                                                ', '\n                                                                    ', '                                                    ', '\n                            ', '\n                            ', 'Добавляем к печени сердце и легкое. Также добавляем нарезанный лук, заливаем бульон и тушим еще 15 минут. ', '\n                                                ', '\n                                                                    ', '                                                    ', '\n                            ', '\n                            ', 'Добавляем картофель и тушим на слабом огне 20 минут. ', '\n                                                ', '\n                                                                    ', '                                                    ', '\n                            ', '\n                            ', 'Готовое блюдо обсыпаем зеленью. ', '\n                                                ', '\n                                                            ']",Количество порций: 3-4,Мясо / Говядина / Говяжье сердце,PT0M,PT120M
98,Бешбармак из говядины,PT180M,"['Говядина                                \xa0—\xa0700\xa0Грамм', 'Лук                                \xa0—\xa03-4\xa0Штук', 'Морковь                                \xa0—\xa01\xa0Штука', 'Мука                                \xa0—\xa03\xa0Стакана', 'Яйца                                \xa0—\xa02-3\xa0Штук', 'Соль                                \xa0—\xa01\xa0Ст. ложка', 'Зелень                                 \xa0—\xa030\xa0Грамм\xa0(укроп, петрушка, зеленый лук)', 'Перец черный молотый                                \xa0—\xa02-3\xa0Щепоток']","['\n                                            ', '                                                    ', '\n                            ', '\n                            ', 'Для приготовления лучше взять грудинку, бульон будет наваристее. Нарезаем мясо на куски, промываем и выкладываем в кастрюлю. Заливаем водой и ставим вариться.', '\n                                                ', '\n                                                                    ', '                                                    ', '\n                            ', '\n                            ', 'Очищаем морковку и лук. Морковь разрезаем на несколько частей, луковицу надрезаем. Как только мясо закипит, снимаем пенку и добавляем в кастрюлю овощи. Закрываем кастрюлю крышкой, уменьшаем огонь и варим до готовности мяса. Примерно часа 2. В конце варки можно добавим соль и молотый перец.', '\n                                                ', '\n                                                                    ', '                                                    ', '\n                            ', '\n                            ', 'Займемся приготовлением теста. Для этого в глубокой миске взбалтываем яйца с водой и солью. Добавляем муку и вымешиваем тесто. Оно должно получится достаточно тугим. ', '\n                                                ', '\n                                                                    ', '                                                    ', '\n                            ', '\n                            ', 'Готовое тесто отправляем в холодильник минут на 30, а пока почистим и нарежем лук.', '\n                                                ', '\n                                                                    ', '                                                    ', '\n                            ', '\n                            ', 'Для удобства, делим тесто на несколько частей. Каждую часто по очереди очень тонко раскатываем. Толщина теста  - примерно 2-3 мм. ', '\n                                                ', '\n                                                                    ', '                                                    ', '\n                            ', '\n                            ', 'Нарезаем пласты теста на ромбики или квадратики. Размер - 5-7 см. Оставляем на столе , пусть подсыхают.', '\n                                                ', '\n                                                                    ', '                                                    ', '\n                            ', '\n                            ', 'Вынимаем готовое мясо из бульона и разрезаем на небольшие куски. Подготовленный лук заливаем горячим бульоном.', '\n                                                ', '\n                                                                    ', '                                                    ', '\n                            ', '\n                            ', 'В кипящем бульоне варим 5-7 минут кусочки теста и выкладываем их на большое блюдо. Посыпаем сверху луком.', '\n                                                ', '\n                                                                    ', '                                                    ', '\n                            ', '\n                            ', 'Затем выкладываем мясо и посыпаем рубленной зеленью. Еще можно сделать острый соус для бешбармака. Смешать мелко порубленный чеснок, перец чили и добавить столовую ложку уксуса и соевого соуса. Очень вкусно:)', '\n                                                ', '\n                                                            ']",Количество порций: 6-8,Мясо / Говядина,PT0M,PT180M
99,Бешбармак из индейки,PT90M,"['Филе индейки                                \xa0—\xa0600\xa0Грамм', 'Мука пшеничная                                \xa0—\xa02\xa0Стакана', 'Лук репчатый                                 \xa0—\xa03\xa0Штуки', 'Вода чистая                                \xa0—\xa00,75\xa0Стакана', 'Яйцо куриное                                \xa0—\xa02\xa0Штуки', 'Растительное масло                                \xa0—\xa01\xa0Ст. ложка', 'Соль                                \xa0—\xa0По вкусу', 'Перец                                \xa0—\xa0По вкусу', 'Специи                                 \xa0—\xa0По вкусу']","['\n                                            ', '                                                    ', '\n                            ', '\n                            ', 'Индейку нарежьте небольшими кусочками и отправьте её вариться в немного подсоленной воде. Время приготовления - около 25 минут. Когда птица будет готова, вытащите её из воды и выложите на тарелку. Бульон, в котором варилась птица, не сливайте.', '\n                                                ', '\n                                                                    ', '                                                    ', '\n                            ', '\n                            ', 'Пока варится индейка, можно приготовить тесто. В миске смешайте яйца, растительное масло, воду. Добавьте щепотку соли и постепенно вводите муку. Должно получится упругое тесто, которое не будет липнуть к рукам. Оставьте тесто при комнатной температуре минут на 20.', '\n                                                ', '\n                                                                    ', '                                                    ', '\n                            ', '\n                            ', 'Репчатый лук очистите и нарежьте полукольцами. На сковороду налейте немного растительного масла и выложите на неё лук. Обжарьте полукольца до готовности, перемешивая их лопаткой.', '\n                                                ', '\n                                                                    ', '                                                    ', '\n                            ', '\n                            ', 'Тесто тонко раскатайте и нарежьте его ромбиками или прямоугольниками. Вскипятите бульон, в котором варилась индейка. В бульон поместите тесто и проварите пять-семь минут. Для подачи выложите ромбики из теста в глубокую тарелку, сверху уложите мясо индейки и жареный лук. Полейте блюдо бульоном, посыпьте чёрным перцем и украсьте зеленью.', '\n                                                ', '\n                                                            ']",Количество порций: 4-6,Птица / Индейка / Мука / Филе индейки,PT0M,PT90M
