,name,total_time,ingredients,instructions,servings,category,prep_time,cook_time
158,Жанышпа,PT60M,"['Пшено                                \xa0—\xa01\xa0Стакан', 'Сахар                                \xa0—\xa02\xa0Ст. ложки', 'Масло сливочное                                \xa0—\xa060\xa0Грамм', 'Сметана                                \xa0—\xa03\xa0Ст. ложки', 'Кипяток                                \xa0—\xa01,5\xa0Стакана']","['\n                                            ', '                                                    ', '\n                            ', '\n                            ', 'Подготовьте необходимые продукты. Пшено промойте теплой водой, залейте теплой водой на 15 минут, слейте воду.', '\n                                                ', '\n                                                                    ', '                                                    ', '\n                            ', '\n                            ', 'Пшено опустите в кипящую воду (1,5 стакана) и отварите в течение 8 минут, в конце варки  помешивая деревянной лопаткой. Затем откиньте на сито, остудите.', '\n                                                ', '\n                                                                    ', '                                                    ', '\n                            ', '\n                            ', 'Добавьте сахар, масло, тщательно разотрите. Добавьте сметану, перемешайте и отправьте под пресс. Я оставила кашу прямо в дуршлаге, а сверху поставила тарелку с прессом. Затем перевернула жанышпа на блюдо.', '\n                                                ', '\n                                                            ']",Количество порций: 4,Крупы / Пшено и пшеница,PT0M,PT60M
159,Турнияз,PT40M,"['Пшено                                \xa0—\xa0140\xa0Грамм', 'Молоко                                \xa0—\xa01\xa0Литр\xa0(3,5% жирности и выше)', 'Вода                                \xa0—\xa0300\xa0Миллилитров', 'Мука                                \xa0—\xa02\xa0Ст. ложки', 'Масло сливочное                                \xa0—\xa01\xa0Ст. ложка', 'Соль                                \xa0—\xa0По вкусу', 'Курт                                \xa0—\xa03\xa0Штуки\xa0(для подачи)']","['\n                                            ', '                                                    ', '\n                            ', '\n                            ', 'Подготовьте необходимые продукты.', '\n                                                ', '\n                                                                    ', '                                                    ', '\n                            ', '\n                            ', 'Пшено промойте в теплой воде до прозрачности.\r\nМуку обжарьте на растопленном сливочном масле до золотистого цвета. Добавьте 2 ст. л. воды, размешайте до однородности.', '\n                                                ', '\n                                                                    ', '                                                    ', '\n                            ', '\n                            ', 'Молоко и оставшуюся воду доведите до кипения, добавьте мучную пасту, перемешайте.\r\nКак только молоко закипит, добавьте промытое пшено, соль. ', '\n                                                ', '\n                                                                    ', '                                                    ', '\n                            ', '\n                            ', 'Уменьшите огонь и готовьте 20-25 минут. Помешивайте через каждые 5 минут.', '\n                                                ', '\n                                                                    ', '                                                    ', '\n                            ', '\n                            ', 'Перед подачей добавьте измельченный курт, перемешайте. Приятного аппетита!', '\n                                                ', '\n                                                            ']",Количество порций: 4,Молочные продукты / Молоко / Крупы / Пшено и пшеница,PT0M,PT40M
160,Бешбармак по-казахски,PT240M,"['Конина                                \xa0—\xa01\xa0Килограмм', 'Говядина                                \xa0—\xa00,5\xa0Килограмма', 'Конская колбаса казы                                \xa0—\xa0300\xa0Грамм', 'Мука                                \xa0—\xa03\xa0Стакана', 'Яйца                                \xa0—\xa03\xa0Штуки', 'Вода                                 \xa0—\xa01\xa0Стакан\xa0(для теста)', 'Морковь                                \xa0—\xa01-2\xa0Штук', 'Картофель                                \xa0—\xa03-4\xa0Штук', 'Лук репчатый                                \xa0—\xa02-3\xa0Штук']",[],Количество порций: 8,Мясо / Говядина / Конина / Тесто,PT0M,PT240M
161,Бешбармак из индейки,PT90M,"['Филе индейки                                \xa0—\xa0600\xa0Грамм', 'Мука пшеничная                                \xa0—\xa02\xa0Стакана', 'Лук репчатый                                 \xa0—\xa03\xa0Штуки', 'Вода чистая                                \xa0—\xa00,75\xa0Стакана', 'Яйцо куриное                                \xa0—\xa02\xa0Штуки', 'Растительное масло                                \xa0—\xa01\xa0Ст. ложка', 'Соль                                \xa0—\xa0По вкусу', 'Перец                                \xa0—\xa0По вкусу', 'Специи                                 \xa0—\xa0По вкусу']","['\n                                            ', '                                                    ', '\n                            ', '\n                            ', 'Индейку нарежьте небольшими кусочками и отправьте её вариться в немного подсоленной воде. Время приготовления - около 25 минут. Когда птица будет готова, вытащите её из воды и выложите на тарелку. Бульон, в котором варилась птица, не сливайте.', '\n                                                ', '\n                                                                    ', '                                                    ', '\n                            ', '\n                            ', 'Пока варится индейка, можно приготовить тесто. В миске смешайте яйца, растительное масло, воду. Добавьте щепотку соли и постепенно вводите муку. Должно получится упругое тесто, которое не будет липнуть к рукам. Оставьте тесто при комнатной температуре минут на 20.', '\n                                                ', '\n                                                                    ', '                                                    ', '\n                            ', '\n                            ', 'Репчатый лук очистите и нарежьте полукольцами. На сковороду налейте немного растительного масла и выложите на неё лук. Обжарьте полукольца до готовности, перемешивая их лопаткой.', '\n                                                ', '\n                                                                    ', '                                                    ', '\n                            ', '\n                            ', 'Тесто тонко раскатайте и нарежьте его ромбиками или прямоугольниками. Вскипятите бульон, в котором варилась индейка. В бульон поместите тесто и проварите пять-семь минут. Для подачи выложите ромбики из теста в глубокую тарелку, сверху уложите мясо индейки и жареный лук. Полейте блюдо бульоном, посыпьте чёрным перцем и украсьте зеленью.', '\n                                                ', '\n                                                            ']",Количество порций: 4-6,Птица / Индейка / Мука / Филе индейки,PT0M,PT90M
162,Куурдак из легких,PT60M,"['Говяжье легкое                                \xa0—\xa01\xa0Штука', 'Печень говяжья                                \xa0—\xa01/2\xa0Штуки', 'Сердце говяжье                                \xa0—\xa01/2\xa0Штуки', 'Сало курдючное                                \xa0—\xa0200\xa0Грамм', 'Картофель                                \xa0—\xa04\xa0Штуки', 'Лук репчатый                                \xa0—\xa02\xa0Штуки', 'Бульон говяжий                                \xa0—\xa02\xa0Стакана', 'Лавровый лист                                \xa0—\xa02\xa0Штуки', 'Соль                                \xa0—\xa0По вкусу', 'Перец                                \xa0—\xa0По вкусу']","['\n                                            ', '                                                    ', '\n                            ', '\n                            ', 'Все субпродукты нарезаем мелкими кубиками. Также мелко нарезаем сало и лук.', '\n                                                ', '\n                                                                    ', '                                                    ', '\n                            ', '\n                            ', 'В разогретый казан выкладываем сало и вытапливаем весь жир, шкварки удаляем.', '\n                                                ', '\n                                                                    ', '                                                    ', '\n                            ', '\n                            ', 'В кипящий жир кладем сердце и обжариваем 15 минут, после чего перекладываем в тарелку.', '\n                                                ', '\n                                                                    ', '                                                    ', '\n                            ', '\n                            ', 'В оставшемся жире обжариваем легкое, 15 минут. Легкое также откладываем в отдельную тарелку. В казан кладем печень, жарим 10 минут и добавляем сердце, легкое и порезанный лук. Жарим еще 10 минут помешивая.', '\n                                                ', '\n                                                                    ', '                                                    ', '\n                            ', '\n                            ', 'Вливаем в казан бульон, соль и перец по вкусу. Тушим 15 минут.', '\n                                                ', '\n                                                                    ', '                                                    ', '\n                            ', '\n                            ', 'Картофель режем кубиками и кладем в казан, тушим все под крышкой 20 минут, время от времени помешивая.', '\n                                                ', '\n                                                                    ', '                                                    ', '\n                            ', '\n                            ', 'Снимаем казан с огня, кладем пару лавровых листиков. При подаче можно украсить зеленью. Приятного аппетита!', '\n                                                ', '\n                                                            ']",Количество порций: 2-3,Мясо / Субпродукты / Печень / Сердце / Легкое,PT0M,PT60M
163,Манты по-казахски,PT80M,"['Баранина                                \xa0—\xa0300\xa0Грамм', 'Сало                                \xa0—\xa020\xa0Грамм', 'Луковица                                \xa0—\xa06-7\xa0Штук', 'Яйцо                                \xa0—\xa01\xa0Штука', 'Мука                                \xa0—\xa0250\xa0Грамм', 'Соль                                \xa0—\xa01\xa0Щепотка', 'Красный перец                                \xa0—\xa01\xa0Щепотка', 'Черный перец                                \xa0—\xa01\xa0Щепотка', 'Зира                                \xa0—\xa01\xa0Щепотка']","['\n                                            ', '                                                    ', '\n                            ', '\n                            ', '1. Как сделать манты по-казахски? Для начала необходимо вымыть и просушить мясо. Затем нарезать его острым ножом на мелкие кусочки. Настоящие манты готовят только из рубленного мяса. ', '\n                                                ', '\n                                                                    ', '                                                    ', '\n                            ', '\n                            ', '2. Далее очистить и нарезать мелкими кубиками лук. Его должно быть действительно много. ', '\n                                                ', '\n                                                                    ', '                                                    ', '\n                            ', '\n                            ', '3. Нарезанное сало и мясо соединить с луком. Тщательно перемешать и добавить соль, специи по вкусу. ', '\n                                                ', '\n                                                                    ', '                                                    ', '\n                            ', '\n                            ', '4. Теперь необходимо приготовить тесто. Для этого нужно вбить в миску яйцо и добавить соль. Немного взбить и влить около 100 миллилитров холодной воды. Тщательно перемешать и сразу добавить около 150 грамм муки. Вымешивать тесто, периодически подсыпая муку. Тесто должно быть крутым и плотным. ', '\n                                                ', '\n                                                                    ', '                                                    ', '\n                            ', '\n                            ', '5. Когда тесто уже готово, его необходимо тщательно вымесить. Не нужно жалеть на это сил и времени, ведь оно должно получится действительно мягким. Работать с тестом около 15-20 минут. Затем отложить на некоторое время, чтобы оно немного ""отдохнуло"". ', '\n                                                ', '\n                                                                    ', '                                                    ', '\n                            ', '\n                            ', '6. Минут через 20 можно снова приступать к работе. Тесто необходимо нарезать на небольшие кусочки острым ножом. ', '\n                                                ', '\n                                                                    ', '                                                    ', '\n                            ', '\n                            ', '7. Каждый кусочек нужно раскатать довольно тонко на поверхности, присыпанной мукой. ', '\n                                                ', '\n                                                                    ', '                                                    ', '\n                            ', '\n                            ', '8. Когда все лепешки готовы, можно выкладывать на них начинку. Чтобы манты были сочнее, сверху можно выложить небольшой кусочек сала. ', '\n                                                ', '\n                                                                    ', '                                                    ', '\n                            ', '\n                            ', '9. Один из самых ответственных процессов - это лепка. Края лепешки нужно сперва соединить и аккуратно слепить. ', '\n                                                ', '\n                                                                    ', '                                                    ', '\n                            ', '\n                            ', '10. Тоже самое следует сделать и с другой стороны. Затем концы слепить между собой и придать форму. ', '\n                                                ', '\n                                                                    ', '                                                    ', '\n                            ', '\n                            ', '11. Смазать растительным маслом лучше не только дно ярусов, но и сами манты. Затем аккуратно выложить на ярусы и поставить над кипящей водой. Через 45 минут манты по-казахски в домашних условиях будут готовы и их можно подавать к столу. ', '\n                                                ', '\n                                                                    ', '                                                    ', '\n                            ', '\n                            ', '11. Смазать растительным маслом лучше не только дно ярусов, но и сами манты. Затем аккуратно выложить на ярусы и поставить над кипящей водой. Через 45 минут манты по-казахски в домашних условиях будут готовы и их можно подавать к столу. ', '\n                                                ', '\n                                                            ']",Количество порций: 6-8,Мясо / Тесто,PT0M,PT80M
