,name,total_time,ingredients,instructions,servings,category,prep_time,cook_time
103,Pepper soup noodles,7 min,"['\n        ', '2', ' super pack noodles\n        \n      ', '\n        ', '2', ' fresh tomatoes (sliced)\n        \n      ', '\n        ', '3 tablespoon', ' pepper(ground)\n        \n      ', '\n        ', '1 teaspoon', ' cameroon pepper\n        \n      ', '\n        ', '1', ' onion bulb medium(chopped)\n        \n      ', '\n        ', '1 tablespoon', ' crayfish (ground)\n        \n      ', '\n        ', ' little scent leaf (sliced)\n        \n      ', '\n        ', '1 teaspoon', ' curry (gino)\n        \n      ', '\n        ', '1 tablespoon', ' vegetable oil\n        \n      ', '\n        ', '3 glass', ' cup water\n        \n      ']","['\n        ', 'Place pot on heat,add 3 glass water allow to boil then add noodles,and the spices inside the pack,add pepper,onion,crayfish allow to boil for 4 min', '\n        \n      ', '\n        ', 'Add curry,tomatoes,vegetable oil and stir everything together after 3min add scent leaf and stir immediately turn off heat.', '\n        \n      ']",2 serving,,,
104,Bsc Party Jollof Rice,,"['\n        ', ' Rice (your desired quantity)\n        \n      ', '\n        ', ' Vegetable oil\n        \n      ', '\n        ', ' Salt (to taste)\n        \n      ', '\n        ', ' Pepper (I used Cameroon pepper)\n        \n      ', '\n        ', ' Seasoning cubes (I used Maggi Naija pot)\n        \n      ', '\n        ', ' Onions\n        \n      ', '\n        ', 'Sachet', ' tomatoes\n        \n      ', '\n        ', ' Fresh tomatoes\n        \n      ', '\n        ', ' Ata rodo\n        \n      ', '\n        ', ' Tatashe\n        \n      ', '\n        ', ' Garlic\n        \n      ', '\n        ', ' White pepper (You can get this at Hubmart stores)\n        \n      ', '\n        ', ' Plantain\n        \n      ', '\n        ', ' Beef\n        \n      ', '\n        ', ' Curry powder\n        \n      ', '\n        ', ' Dried thyme\n        \n      ', '\n        ', ' Carrot\n        \n      ', '\n        ', ' Spring onions\n        \n      ', '\n        ', ' And/B: No restrictions to the type of vegetable(s) you can use\n        \n      ']","['\n        ', 'The most important thing when cooking is “mise en place” get all your ingredients ready. Chop everything that needs to be chopped and you’re good to go.', '\n        \n      ', '\n        ', 'Blend the tomatoes, onions, tatashe (red bell pepper) and ata rodo (scotch bonnet/habanero pepper) to a smooth paste.', '\n        \n      ', '\n        ', 'Blend the garlic to paste form and set aside.', '\n        \n      ', '\n        ', 'Pour the rice(unwashed)into a bowl and boil for few minutes till “al dente” (cooked but firm).', '\n        \n      ', '\n        ', 'Proceed to wash the rice after boiling.', '\n        \n      ', '\n        ', 'Fry the tomato sauce with 4-5 cooking spoons of oil (vegetable or olive) and onions.', '\n        \n      ', '\n        ', 'Add the tomato paste, let the tomato paste fry with the pepper till it thickens and small bubbles form. Taste for salt and seasoning. If it needs more, add more. Now it is time to add the pre-cooked rice to the pot followed by more beef stock and then stir. I then proceeded to add the white pepper and garlic here cos I wanted the whole Party Jollof Rice taste and aroma', '\n        \n      ', '\n        ', 'While cooking Party Jollof Rice,it’s advisable to use wooden spoon to stir. This helps in avoiding clumping while cooking', '\n        \n      ', '\n        ', 'Once the rice is cooked,add vegetables. In this case I added carrot and spring onions.', '\n        \n      ', '\n        ', ""Put off the cooker and cover the rice with a foil paper. This ensures that the rice retains it's steam and trust me it does wonders."", '\n        \n      ', '\n        ', 'Go ahead to fry plantain', '\n        \n      ', '\n        ', 'Remove the foil from the rice and stir (with a wooden spoon as mentioned earlier)', '\n        \n      ', '\n        ', 'Serve the rice with plantain or any other side dish of your choice.', '\n        \n      ', '\n        ', 'Get people thinking how you turned your everyday meal to Owambe worthy', '\n        \n      ']",1 person,,,
105,Macjollof rice in chicken stock,13mins,"['\n        ', '2 cups', ' rice\n        \n      ', '\n        ', ' Chicken stock\n        \n      ', '\n        ', ' Chilli pepper\n        \n      ', '\n        ', ' Onions\n        \n      ', '\n        ', ' Salt\n        \n      ', '\n        ', ' Maggi\n        \n      ', '\n        ', ' Cameroon pepper\n        \n      ', '\n        ', 'piece', ' Chicken\n        \n      ', '\n        ', ' Macaroni\n        \n      ']","['\n        ', 'Parboil the rice and macaroni set aside.', '\n        \n      ', '\n        ', 'Wash and blend the pepper', '\n        \n      ', '\n        ', 'In your chicken stock,,, add the onious and other spices', '\n        \n      ', '\n        ', 'Allow to boil for 3 mins', '\n        \n      ', '\n        ', 'Put in your rice and allow to cook for 10mins.', '\n        \n      ', '\n        ', 'Serve hot...', '\n        \n      ']",2servings,,,
106,White Soup (Afia efere),45mins,"['\n        ', '1', ' full chicken\n        \n      ', '\n        ', ' uyak pod (pepper soup spice)\n        \n      ', '\n        ', ' Chicken Stock\n        \n      ', '\n        ', 'cubes', ' quarter of yam sliced and cut in big\n        \n      ', '\n        ', 'to taste', ' salt\n        \n      ', '\n        ', '1 tsp', ' cameroon pepper\n        \n      ', '\n        ', '2', ' fresh pepper blended\n        \n      ', '\n        ', '2', ' knorr cube\n        \n      ', '\n        ', '1/2 cup', ' Uziza leaf (optional)\n        \n      ']","['\n        ', 'Wash and parboil the chicken and spice with salt and pepper allow cook halfway add yam and cook till it tender, you can remove some of the yam and pound it to make your pounded yam and leave the rest in the pot to help thicken the soup', '\n        \n      ', '\n        ', 'Add uyak pod that is the pepper soup spice, fresh pepper and then stir and allow to boil for about 10minutes', '\n        \n      ', '\n        ', 'Stir in the uziza leaf and turn off the heat; serve with pounded yam or you can enjoy it alone as a soup', '\n        \n      ']",8 servings,,,
107,Fried Fish,30mins,"['\n        ', '2 kg', ' Titus Fish (Mackerel)\n        \n      ', '\n        ', 'to taste', ' salt\n        \n      ', '\n        ', '2', ' knorr cube\n        \n      ', '\n        ', '1 tsp', ' Cameroon pepper\n        \n      ', '\n        ', ' Palm oil for frying\n        \n      ']","['\n        ', 'Wash fish and remove dirts afterward, sprinkle salt, pepper and knorr cube and set it aside to marinate', '\n        \n      ', '\n        ', 'Once you are ready to fry the fish use a shallow pot and heat up palm oil inside the pot for deep drying', '\n        \n      ', '\n        ', ""Add marinated titus fish and fry till it's fried through and tender"", '\n        \n      ', '\n        ', 'Drain in a pepper towel and serve or use to prepare fish stew or vegetable sauce', '\n        \n      ']",,,,
108,Rice and Vegetables,45minutes,"['\n        ', ' Carrot\n        \n      ', '\n        ', ' Spring Onions\n        \n      ', '\n        ', ' Green peas\n        \n      ', '\n        ', ' Grean Beans\n        \n      ', '\n        ', ' Green pepper\n        \n      ', '\n        ', ' Cameroon pepper\n        \n      ', '\n        ', ' Curry\n        \n      ', '\n        ', ' Thyme\n        \n      ', '\n        ', ' Meat stock\n        \n      ', '\n        ', ' Sliced Pomo\n        \n      ', '\n        ', ' Water\n        \n      ', '\n        ', ' Salt\n        \n      ', '\n        ', ' Maggi\n        \n      ', '\n        ', ' Rice\n        \n      ']","['\n        ', 'Slice your meat and boil,', '\n        \n      ', '\n        ', 'Slice your vegetables, carrots,spring onions, green peas and green beans and boil adding your meat stock and seasoning', '\n        \n      ', '\n        ', 'Add enough Cameroon pepper', '\n        \n      ', '\n        ', 'Add your meat to the mixture and leave to boil...', '\n        \n      ', '\n        ', ""Boil your rice and add carrots when its almost done so it won't get too soft"", '\n        \n      ']",5servings,,,
109,Goat Meat Pepper Soup,35mins,"['\n        ', '1 kg', ' pieces goat meat\n        \n      ', '\n        ', '4', ' offal\n        \n      ', '\n        ', '2 tbsp', ' pepper soup spice\n        \n      ', '\n        ', ' salt taste\n        \n      ', '\n        ', '3', ' knorr cube\n        \n      ', '\n        ', '3 tbsp', ' Cameroon pepper\n        \n      ', '\n        ', '1/2', ' bulb onion blended\n        \n      ', '\n        ', '1 tbsp', ' crayfish blended\n        \n      ']","['\n        ', 'Wash goat meat and offal and place on fire, add salt, pepper, knorr cube and Cameroon pepper', '\n        \n      ', '\n        ', 'Once the meat is almost tender, add pepper soup spice, blended crayfish and the onions, if you have scent leaf that will be the last thing before turning off the heat.', '\n        \n      ', '\n        ', 'Allow it cook for another 5mins and then turn off the heat and serve', '\n        \n      ']",8 servings,,,
110,Ofe Onugbu (Bitterleaf soup),1 cooksnap,"['\n        ', ' Meat\n        \n      ', '\n        ', ' Dried fish/stock fish\n        \n      ', '\n        ', ' Bitterleaf\n        \n      ', '\n        ', ' Palm oil\n        \n      ', '\n        ', ' Cocoyam\n        \n      ', '\n        ', ' Ogiri\n        \n      ', '\n        ', ' Crayfish\n        \n      ', '\n        ', ' Cameroon pepper\n        \n      ', '\n        ', ' Onions\n        \n      ', '\n        ', 'cubes', ' Seasoning\n        \n      ', '\n        ', ' Salt\n        \n      ']","['\n        ', ""First of all you have to prep your ingredients: Wash your bitterleaf till the bitterness is almost gone, It should still be slightly bitter tho. It's best to dry your leaves in the sun for an hour or so before washing to prevent them from scattering too much."", '\n        \n      ', '\n        ', ""Next, wash your cocoyam thoroughly and boil without peeling. When it's done, peel off the skin and pound into a smooth paste."", '\n        \n      ', '\n        ', 'Boil your meat and fish with salt, Seasoning cubes and onions. When your meat is almost done, add your blended pepper and crayfish and continue cooking.', '\n        \n      ', '\n        ', 'Mix your palm oil with the cocoyam paste and add into the soup bit by bit, stirring after each addition. Add your Ogiri and cook for a few minutes till your cocoyam has completely dissolved into the soup.', '\n        \n      ', '\n        ', 'Add your bitterleaf. Taste for Seasoning and adjust to suit your taste. Cook for about 3mins and turn off the heat. Your ofe onugbu is ready!', '\n        \n      ']",,,,
111,Oha soup,,"['\n        ', 'leaves', ' Oha\n        \n      ', '\n        ', ' Éde (cocoyam)\n        \n      ', '\n        ', ' Palm oil\n        \n      ', '\n        ', ' Stock fish\n        \n      ', '\n        ', ' Dry fish\n        \n      ', '\n        ', ' Meat (assorted)\n        \n      ', '\n        ', ' Ogiri\n        \n      ', '\n        ', ' Seasoning (Maggi and salt)\n        \n      ', '\n        ', ' Crayfish\n        \n      ', '\n        ', ' Cameroon pepper\n        \n      ', '\n        ', 'leaves', ' Oha\n        \n      ', '\n        ', ' Éde (cocoyam)\n        \n      ', '\n        ', ' Palm oil\n        \n      ', '\n        ', ' Stock fish\n        \n      ', '\n        ', ' Dry fish\n        \n      ', '\n        ', ' Meat (assorted)\n        \n      ', '\n        ', ' Ogiri\n        \n      ', '\n        ', ' Seasoning (Maggi and salt)\n        \n      ', '\n        ', ' Crayfish\n        \n      ', '\n        ', ' Cameroon pepper\n        \n      ']","['\n        ', 'Season your meat with Maggi and salt then boil it.', '\n        \n      ', '\n        ', 'Boil your cocoyam (Éde)', '\n        \n      ', '\n        ', 'Once the cocoyam is boiled, pound it in a motar (it gets sticky) so add a little palm oil to remove the stickiness.', '\n        \n      ', '\n        ', 'Grind the crayfish and Cameroon pepper together and keep it aside.', '\n        \n      ', '\n        ', 'Wash your stock fish and dry fish then add it to the boiling meat', '\n        \n      ', '\n        ', 'Once Your meat is ready and soft enough to be eaten, add the ground crayfish and Cameroon pepper.', '\n        \n      ', '\n        ', 'Add the palm oil to this mixture and leave it to boil for like 10 mins', '\n        \n      ', '\n        ', ""Add the pounded cocoyam into the pot and scatter it so it can melt properly and leave it to boil. the cocoyam is for thickening of the soup. remember to add water if the soup looks too thick but make sure it's not too much. 10 mins"", '\n        \n      ', '\n        ', 'Add the seasoning.Add the ogiri to the soup (this is for flavor just like iru). Mix all the ingredients together and let it boil. 10mins', '\n        \n      ', '\n        ', 'Wash your oha leaves and then add it to the soup and mix. Wait for 2 mins and your soup is ready', '\n        \n      ', '\n        ', 'It can be eaten with Eba, fufu or pounded yam', '\n        \n      ', '\n        ', 'Add the seasoning.Add the ogiri to the soup (this is for flavor just like iru). Mix all the ingredients together and let it boil. 10mins', '\n        \n      ', '\n        ', 'Wash your oha leaves and then add it to the soup and mix. Wait for 2 mins and your soup is ready', '\n        \n      ', '\n        ', 'It can be eaten with Eba, fufu or pounded yam', '\n        \n      ']",15 servings,,,
112,Yam cubes in Fresh Fish Pepper soup!,45 mins,"['\n        ', '1', ' big catfish (cut into 8 pieces)\n        \n      ', '\n        ', '10', ' bell peppers (grounded)\n        \n      ', '\n        ', '1', ' large onion bulb (grounded)\n        \n      ', '\n        ', '1 ounce', ' crayfish (grounded)\n        \n      ', '\n        ', '2 ounce', ' ground Cameroon pepper\n        \n      ', '\n        ', 'to taste', ' Salt\n        \n      ', '\n        ', ' Knorr seasoning\n        \n      ', '\n        ', ' Pepper soup spices\n        \n      ', '\n        ', ' Yam (cut in cubes)\n        \n      ']","['\n        ', 'In a large pot, place ground pepper, onions, crayfish, pepper soup spices, Cameroon pepper, salt, knorr, water and bring to boil', '\n        \n      ', '\n        ', 'After 10mins, add washed fish seasoned with a little salt and knorr seasoning into soup and allow to boil on low heat for 20 mins.', '\n        \n      ', '\n        ', 'On another burner, place yam cube seasoned with a little salt and boil for 10mins then lower heat and seamer for 3 mins', '\n        \n      ', '\n        ', 'Serve cooked yam cubes in a soup bowl and add pepper soup on top.', '\n        \n      ', '\n        ', 'Enjoy so much deliciousness....', '\n        \n      ']",4 servings,,,
113,Hot Dog,,"['\n        ', '4', ' hot dog buns\n        \n      ', '\n        ', '4', ' hot dog/franks\n        \n      ', '\n        ', ' lettuce\n        \n      ', '\n        ', ' mayonnaise\n        \n      ', '\n        ', ' ketchup\n        \n      ', '\n        ', 'dash', ' Cameroon pepper\n        \n      ']","['\n        ', 'Pan fry hot dog with little oil or no oil using a non stick or maybe place inside a microwave', '\n        \n      ', '\n        ', 'To make your mayochup in a small bowl, pour in quantity of mayonnaise you need and the quantity of ketchup you want, mix properly', '\n        \n      ', '\n        ', 'Add Cameroon pepper to give it a tingy/spicy taste; then set aside', '\n        \n      ', '\n        ', 'Cut hot dog bun into 2 place the washed lettuce into the bun and place the hot dog and then spinke the sauce', '\n        \n      ', '\n        ', 'Then serve', '\n        \n      ']",,,,
114,Fish pepper soup,1 cooksnap,"['\n        ', '1 kg', ' White cat fish, 1 table spoon of Cameroon pepper, 1 knor cube, salt and scent leaf\n        \n      ']","['\n        ', 'Use salt to wash the body', '\n        \n      ', '\n        ', 'Spice with fish spice, salt knot and Cameroon pepper', '\n        \n      ', '\n        ', 'Cook for 35 minits', '\n        \n      ', '\n        ', 'Sarve with white rice or eat with white wine', '\n        \n      ']",2 servings,,,
115,"Fried indomine, side salad and plantain",,"['\n        ', '2 (70 g)', ' indomine\n        \n      ', '\n        ', ' Egg\n        \n      ', '\n        ', ' Maggi\n        \n      ', '\n        ', ' Salt\n        \n      ', '\n        ', ' Oil\n        \n      ', '\n        ', ' Plantain\n        \n      ', '\n        ', ' Carrot\n        \n      ', '\n        ', ' Cabbage\n        \n      ', '\n        ', ' Mayonise\n        \n      ', '\n        ', '1', ' hard tomato\n        \n      ', '\n        ', ' Cameroon pepper\n        \n      ', '\n        ', ' Cucumber\n        \n      ', '\n        ', '6', ' eggs\n        \n      ']","['\n        ', 'Fried indomine, boil water pour over indomine and cover, after 10mins drain the water, break 4eggs add pepper, tomatoes, onions, maggi and salt to taste, whisk together and pour over the insomine, whisk very well, put oil I the pan and put on heat, when the oil is hot put the mixture,fry on low head, fry to brown and your fried indomine is ready', '\n        \n      ', '\n        ', 'Cut your plantain into cubes and fry', '\n        \n      ', '\n        ', 'Cut your cabbage, cucumber, carrot, tomatoes, onions and egg separately and mix together add Cameroon pepper and mayonise, your slide salad is ready', '\n        \n      ']",,,,
116,Spicy Beetroot Jam,1 mins,"['\n        ', '5', ' small Cameroon pepper\n        \n      ', '\n        ', '5', ' medium sized Beetroot\n        \n      ', '\n        ', ' Lemon zest\n        \n      ', '\n        ', '1 cup', ' Sugar\n        \n      ', '\n        ', '2-3 cups', ' Water\n        \n      ', '\n        ', 'Pinch', ' salt\n        \n      ', '\n        ', '1 tsp', ' preservative\n        \n      ']","['\n        ', 'Peel, wash and cut beetroots into cubes. Deseed pepper and add to beetroots. Add water and blend. Ensure well blended.', '\n        \n      ', '\n        ', 'Pour into suace pan, add salt, sugar and the remaining water used to rinse blender.', '\n        \n      ', '\n        ', 'Cook and allow to reduce. Leave a wooden stick in pot to avoid it pouring over.', '\n        \n      ', '\n        ', 'Continue to cook until water dries out completely.', '\n        \n      ', '\n        ', 'Allow to cool. Zest lemon and stir. Add preservative which is optional.', '\n        \n      ', '\n        ', 'Pour into container and airtight.', '\n        \n      ']",8 servings,,,
117,Hot spring rolls and samosa,5minutes,"['\n        ', '300 g', ' flour\n        \n      ', '\n        ', '6', ' spns cornflour\n        \n      ', '\n        ', 'to taste', ' Salt\n        \n      ', '\n        ', ' Water\n        \n      ', '\n        ', '1', ' small cabbage\n        \n      ', '\n        ', '3', ' big carrots\n        \n      ', '\n        ', '500 g', ' chicken meat\n        \n      ', '\n        ', '3', ' stock cube\n        \n      ', '\n        ', ' Curry\n        \n      ', '\n        ', ' Ginger\n        \n      ', '\n        ', ' Garlic\n        \n      ', '\n        ', ' Cameroon pepper\n        \n      ', '\n        ', ' Soyoil\n        \n      ', '\n        ', '1', ' litter vegetable oil\n        \n      ']","['\n        ', ""Mix flour,water,salt,cornstarch into a thin paste. Use painter's brush(red in color) scoop a little portion and spread evenly on a preheated non stick pan leave for 10seconds turn over leave for 5seconds and remove from the pan. Continue the same process till desired number of raps is gotten."", '\n        \n      ', '\n        ', 'For samosa; boil chicken meat, drain water away,pour into a blender and blend just twice. Preheat oil add onion, blended chicken, add spices to taste great and stir fry to remove excess water.', '\n        \n      ', '\n        ', 'For spring rolls;preheat oil add shredded vegetables add spices to taste stir fry to remove excess water.', '\n        \n      ', '\n        ', 'Make flour paste to glue the rap. Take a rap fold it into a cone shape add a spoonfull of samosa filling and fold into an envelope shape. Take another rap, add a spoonful of spring roll filling roll and fold in well.', '\n        \n      ', '\n        ', 'Fry small chops in a preheated oil to obtain a golden brown color.', '\n        \n      ']",6 servings,,,
118,Stir Fry (Chinese),35mins,"['\n        ', '1 kg', ' chicken de bones\n        \n      ', '\n        ', '3', ' green bell pepper diced in chunk\n        \n      ', '\n        ', '4', ' carrot dice in chunk\n        \n      ', '\n        ', '2 tbsp', ' dark soy sauce\n        \n      ', '\n        ', '1 tsp', ' corn flower\n        \n      ', '\n        ', 'to taste', ' salt\n        \n      ', '\n        ', '1', ' bulb onion diced in chunk\n        \n      ', '\n        ', '1 tbsp', ' Cameroon pepper\n        \n      ', '\n        ', '2', ' knorr cube\n        \n      ', '\n        ', '5 tbsp', ' veg oil\n        \n      ', '\n        ', '1 tsp', ' curry powder\n        \n      ']","['\n        ', 'Heat up frying pan once its hot, add veg oil and stir in half of the diced onions and chicken; stir continuously till its tender', '\n        \n      ', '\n        ', 'Add Cameroon pepper, knorr cube and curry powder, mix alittle water and corn flower together and pour into the sauce to get the thicken paste', '\n        \n      ', '\n        ', 'Allow it cook for about 5mins then add green bell pepper, carrot and remaining onions; stir and turn off the heat', '\n        \n      ', '\n        ', 'Serve with white basmati rice', '\n        \n      ']",8 servings,,,
119,Fresh Spring rolls,20 minutes,"['\n        ', '500 g', ' flour\n        \n      ', '\n        ', '3 pinch', ' salt\n        \n      ', '\n        ', '3 spoons', ' cornflour\n        \n      ', '\n        ', ' Water\n        \n      ', '\n        ', '1/2', ' ball cabbage\n        \n      ', '\n        ', '4', ' big carrot\n        \n      ', '\n        ', '2', ' spns soy oil\n        \n      ', '\n        ', 'Pinch', ' minced garlic n ginger\n        \n      ', '\n        ', '1', ' stock cube\n        \n      ', '\n        ', '1', ' tblsp mixed spice\n        \n      ', '\n        ', '1 tsp', ' Cameroon pepper\n        \n      ', '\n        ', '1 litre', ' vegetable oil\n        \n      ']","['\n        ', ""Mix flour,salt,cornflour and water to form a thin paste. Preheat a nonstick pan use a multipurpose brush (painter's brush red in color) scoop the flour paste evenly spread allow to form rap turn over leave for one 5seconds and remove it. Continue the same process till desired number of rap is gotten."", '\n        \n      ', '\n        ', 'For the fill;wash cabbage n carrot and shred. Preheat oil add veges,stock cube, pepper, garlic n ginger stir fry for 2 minutes.', '\n        \n      ', '\n        ', 'Make 2 spoons of flour paste to seal your springroll raps. Take a rap put one spoon full of your filling roll the rap to completely rap up apply flour paste to seal the edges.', '\n        \n      ', '\n        ', 'Preheat vegetable oil and deep fry springrolls to golden brown.', '\n        \n      ']",3 servings,,,
120,Delicious stew,43 min,"['\n        ', '10', ' fresh tomatoes\n        \n      ', '\n        ', '1 sachet', ' tomato paste\n        \n      ', '\n        ', '7', ' goat leg\n        \n      ', '\n        ', '7', ' fresh pepper\n        \n      ', '\n        ', '1 tablespoon', ' cameroon pepper\n        \n      ', '\n        ', '2', ' onion bulb\n        \n      ', '\n        ', '5 cube', ' maggi\n        \n      ', '\n        ', '1', ' small piece ginger\n        \n      ', '\n        ', 'to taste', ' salt\n        \n      ', '\n        ', '1/2 cup', ' vegetable oil\n        \n      ']","['\n        ', 'Wash goat legs very well,put in a clean pot add maggi,salt,little onion,cameroon pepper and boil for 35 min', '\n        \n      ', '\n        ', 'Place a dry pot on heat,add veg oil after 1 min add then add onion,tomato,pepper,ginger and fry for 7 min.', '\n        \n      ', '\n        ', 'When the water in the tomato has dried up then add meat stock,salt after 5 min turn off heat.', '\n        \n      ', '\n        ', 'Serve with rice so yummy.', '\n        \n      ']",3 serving,,,
121,Sumptuous melon soup,26 mins,"['\n        ', '300 g', ' chicken meat\n        \n      ', '\n        ', '2 cup', ' melon (ground)\n        \n      ', '\n        ', '2 tablespoon', ' cameroon pepper\n        \n      ', '\n        ', '1/2 cup', ' palm oil\n        \n      ', '\n        ', '5', ' cube\n        \n      ', '\n        ', '2', ' onion bulb chopped\n        \n      ', '\n        ', '2 tablespoon', ' crayfish\n        \n      ', '\n        ', 'to taste', ' salt\n        \n      ', '\n        ', '2 bunch', ' pumpkin leaf chopped\n        \n      ']","['\n        ', 'Boil meat with maggi,salt for 20 min,pour meat in a bowl.place the pot back on heat.', '\n        \n      ', '\n        ', 'Add palm oil,onion and melon fry for 2 min,then add meat stock,and pepper,crayfish allow to boil for 3 min', '\n        \n      ', '\n        ', 'Add salt and stir soup then add pumpkin leaf for 1min soup is ready.', '\n        \n      ', '\n        ', 'Melon soup is ready so fast and delicious.can be eaten with semo etc.', '\n        \n      ']",4 serving,,,
