,name,total_time,ingredients,instructions,servings,category,prep_time,cook_time
31,White Asparagus with Smoked Salmon &amp; Dill Béarnaise Sauce,PT75M,"['8 thick fresh white asparagus', '5,5 oz smoked salmon ((155 g), thinly sliced)', '3 tbsp onion (chopped)', '1 egg yolk', '2 tbsp red wine vinegar', '3,5 oz unsalted butter ((100 g), ice cold and diced)', 'a good handful fresh dill (chopped)', 'pepper', 'salt']","['First off: peel the white asparagus. Place them horizontally flat on a clean chopping board and hold them with one hand by their heads. Then with your free hand carefully run a vegetable peeler from the heads towards the bottom part. Turn the asparagus as you go until you have removed every inch of the tough skin.', 'Once you have peeled all the white asparagus, check the bottom parts and chop them off if they are dried out. Fill a large and wide pan with plenty of cold water and bring it to a gentle boil over medium heat. Then add the peeled white asparagus to the boiling water and cook them for about 6 to 8 minutes (depending on how thick they are) until the white asparagus are tender.', 'Then drain the cooked white asparagus and keep them covered under some tinfoil until needed later on. In the meantime add the chopped yellow onion and the red wine vinegar to a medium saucepan and bring it to a gentle boil.', 'Let the vinegar reduce fully. Then take the saucepan off the heat and let the onions cool for about 5 minutes. Then add the egg yolk. Season with a pinch of pepper and salt.', ""Quickly whisk the yolk and the lukewarm cooked onion so it doesn't scramble. Put the saucepan back over very low heat."", 'One by one add the pieces of the cold diced unsalted butter and continuously move it around on a fork until melted. Keep the heat very low.', ""The sauce takes a while to come together, take your time. It needs to be done carefully so don't hurry or the creamy bernaise sauce will split. The sauce will slightly thicken and become creamy after a while. Season with another a pinch of pepper and salt. Then add the freshly chopped dill to the sauce."", 'Check the seasoning and add extra pepper or salt to taste if necessary. Then take the saucepan with the dill bernaise sauce off the heat. Divide the thin slices of smoked salmon over plates and top with the cooked white asparagus. Drizzle the white asparagus with smoked salmon with the creamy dill bernaise sauce and serve immediately.']","['2', '2 people']","['Main Course', 'Starter']",PT30M,PT45M
32,Stoemp,PT90M,"['2 pork sausages', '2 thick slices salted bacon', '1 lb potatoes for mash ((450 g), peeled and chopped)', '7 oz savoy cabbage ((200 g))', '3 medium garlic cloves (chopped)', '1 handful fresh parsley (chopped)', '3 tbsp unsalted butter', '¼ cup whole milk ((60 ml))', 'nutmeg', 'pepper', 'salt']","['Add the chopped potatoes and garlic to a high pan and fill it with tap water until the potatoes are fully submerged.', 'Add some salt. Then place the pan over high heat and bring the potatoes to a boil. Cook them until tender. In the meantime rinse and drain the savoy cabbage. Slice it up finely.', 'Add a tablespoon of the butter to a large non-stick pan and place it over medium-high heat. Once the butter has melted, then add the finely sliced savoy cabbage. Season with a pinch of pepper and salt.', 'Stir fry the cabbage for 10 minutes or until the cabbage is soft and smooth. Then turn the heat off and take the cabbage off the heat. Bake the bacon in a non-stick pan without any butter or oil until brown and a little crisp.', 'Then transfer the bacon on a plate and cover with tinfoil. On the same pan you just cooked the bacon in, add a teaspoon of unsalted butter. Bake the sausages in it until browned and cooked through.', 'Then add the cooked bacon to the same pan again and cover with a lid to keep the meat warm. Drain the cooked potatoes and garlic, add them back to the pan you cooked them in together with the fried cabbage.', 'Sprinkle with some pepper, salt and nutmeg. Also add the whole milk.', 'Stir and add the freshly chopped parsley and the rest of the unsalted butter.', 'Mash the potatoes, parsley and cabbage up. Add extra butter or milk if necessary. Also check the seasoning and add extra pepper, nutmeg or salt to taste if necessary. Scoop the cabbage mash onto plates and top with the baked sausage and a slice of bacon. Serve hot.']","['2', '2 people']",['Main Course'],PT30M,PT60M
33,Tomate Aux Crevettes (Shrimp Stuffed Tomatoes),PT60M,"['4 large fresh tomatoes', '12,5 oz grey North Sea shrimp ((350 g), peeled)', '1 egg yolk', '1 tsp strong mustard', '½ cup groundnut oil ((120 ml))', '1 tsp lemon juice', 'a handful fresh parsley', 'pepper', 'salt']","['You can peel the tomatoes if you prefer. Therefore make a little incision on the bottom and poach the tomatoes in hot water for 15 seconds.', 'Then peel them. I kept the skins on. Slice off the tops of the tomatoes. Remove the inside and seeds. Clean it up nicely. Try not to pierce the skin.', 'Then place the tomatoes in the fridge. Now make the mayonnaise (if you are using store-bought mayo, skip the following steps). Add the egg yolk and the strong mustard to a large mixing bowl. Season with a little pepper and salt.', 'The yolk should be at room temperature. If the ingredients are too cold, the mayo will split more easily. Then beat the yolk mixture quickly using a large balloon whisk.', 'Then add the groundnut oil, drop by drop. Whisk in between additions. Don’t add too much in the beginning or the mayo will split right away.', 'Keep on whisking the egg yolk and oil mixture firmly until it becomes a little creamier and thicker. Then add little splashes of the groundnut oil. The mayo should gradually come together and start to look glossy. Take your time. Once you have added all the groundnut oil, add the lemon juice. This will make the mayo paler. Then check the seasoning of the thick mayo and add extra pepper, salt, strong mustard or lemon juice to taste.', 'Transfer the grey shrimp to a large bowl and add the chopped parsley. Season with pepper and salt.', 'Also add the (freshly made) mayo and stir the shrimp well.', 'With a tablespoon fill the empty tomatoes with the shrimp salad. Serve cold.']","['4', '4 people']","['Lunch', 'Main Course']",PT60M,
34,Buttery Braised Mustard Carrots,PT40M,"['1 ½ lbs fresh carrots ((675 g))', '3 garlic cloves', '2 bay leaves', '1 medium onion', '2 tbsp strong mustard', '2 tbsp unsalted butter', 'salt']","['Peel and chop the garlic cloves and onion. Add the butter to a large non-stick pan and place it over medium heat. Add the chopped onion and garlic to it.', 'Let the butter melt gently and stir fry the onion and garlic for a couple of minutes. Add half of the mustard and the bay leaves. Season with a little pinch of salt.', 'Stir well again and let the onion cook for another 3 minutes. In the meantime peel the carrots and grate them roughly.', 'Add the grated carrots to the cooked onion.', 'Stir well. Add a splash of water to the pan and let the carrots braise and soften under a lid over medium heat for about 20 minutes. They should still be a little crunchy. Stir regularly.', 'Once the carrots are cooked, check the seasoning and add extra mustard or salt to taste if necessary. Remove the bay leaves and scoop the braised carrots into bowls. Serve hot.']","['2', '2 people']",['Side Dish'],PT10M,PT30M
35,White Asparagus with Shrimp Salad,PT40M,"['8 thick fresh white asparagus', '4,5 oz grey North Sea shrimp ((125 g), peeled)', 'a handful fresh parsley (chopped)', '1 tbsp mayonnaise', '1 tbsp cream', 'pepper', 'salt']","['Peel the white asparagus. Place them on a clean chopping board and hold them with one hand by their heads. Carefully peel the asparagus with a vegetable peeler from top to bottom. Turn the asparagus and peel it until you have removed every inch of the tough skin.', 'Once you have peeled all the asparagus, chop off the bottom parts if they are dried out. Fill a large casserole with tap water and bring it to a gentle boil. Season with a pinch of salt. Add the asparagus and cook them for 7 to 8 minutes (depends how thick they are) until tender. Keep an eye on them, asparagus overcook easily.', 'In the meantime transfer the shrimp to a small mixing bowl and add the freshly chopped parsley.', 'Stir well. Then add the mayonnaise and the cream. Season with a good pinch of pepper and salt.', 'Stir the shrimp salad well. Check the seasoning and add extra pepper or salt to taste if necessary. Put the shrimp in the fridge for later. Once the asparagus are tender, immediately drain them and divide them over plates. Garnish with the shrimp salad. Finish with a sprinkle of freshly ground black pepper. Serve warm.']","['2', '2 people']","['Lunch', 'Main Course', 'Starter']",PT30M,PT10M
36,Leeks Au Gratin with Beer,PT75M,"['3 large fresh leeks', '1 small garlic clove', '¼ cup pilsner beer ((60 ml))', '1 oz cheese ((30 g), grated)', '2 tbsp breadcrumbs or panko', 'olive oil', 'pepper', 'salt']","['Chop off the roots and remove the greener tougher parts. You can keep the latter aside to make a soup later.&nbsp;Then chop the leeks into 1 inch thick pieces. Rinse them very carefully under wold running tap water. Make sure those pieces stay intact!', 'Peel the garlic clove and slice it in half. In a large non-stick pan (preferably one that is oven-proof, with a lid) add a splash of olive oil and the garlic. Season with a good dash of pepper and a pinch of salt. Then place the pan over medium-high heat.', 'Fry the garlic for 2 minutes in the hot oil. Remove both pieces and turn the heat lower to medium. Arrange the leeks nicely over the pan (cut sides down).', 'Then fry the leeks for 5 to 6 minutes until the bottom part starts to turn brown. Carefully turn the leeks onto their uncooked side.&nbsp;Cook for another 4 to 5 minutes. Season with pepper again. Then pour in the pilsner beer.', 'Turn the heat up high until boiling. Then turn the heat down to a simmer and cover the pan. Let the leeks cook for 10 minutes. Remove the lid and then let the remaining juices evaporate. Now if your pan is fit to put in the oven, just leave the leeks inside. If not, carefully transfer the leeks to a large baking dish. Then sprinkle with the cheese and panko. Season with some pepper and salt.', 'Bake the leeks under a preheated grill for 3 to 4 minutes until the cheese has melted and the panko starts to turn brown.&nbsp;Then remove the leeks au gratin and let it cool for 2 minutes. Serve.']","['2', '2 people']",['Side Dish'],PT30M,PT45M
37,Eels in Green Sauce (Paling in ’t Groen),PT120M,"['1 ⅖ lbs fresh eel ((650 g), cleaned)', '2 medium shallots (chopped finely)', '1 large garlic clove (chopped finely)', 'a handful fresh chervil', 'a small handful fresh parsley', '2 handfuls fresh spinach', 'a small handful fresh mint', 'a small handful fresh oregano', '8 leaves fresh sorrel', '½ cup dry white wine ((120 ml))', '1 cup fish stock ((240 ml))', '1 tbsp lemon juice', '2 tbsp unsalted butter', 'pepper', 'salt']","['Heat a large pan of water until boiling. Rinse the spinach. Cut the leaves in half and remove the tougher line in the middle. Also trim the fresh herbs and remove any tough stems. Then add the spinach, chervil, parsley, mint and oregano to a sieve and rinse well.', 'Let the greens drain. Once the water is boiling, add the spinach and herbs (don’t add the sorrel yet). Stir gently and let them all blanch in the hot water for just a minute, not more.', 'Then strain the blanched spinach and herbs and immediately refresh them under cold running tap water to preserve the fresh green color. Transfer the blanched greens to a bowl, then add cold water and place it in the fridge.', 'Rinse the eels and cut them into 3-inch (7 cm) bits.', 'Melt half of the butter in a large casserole. Also add the chopped shallot and garlic.', 'Gently fry them for 3 minutes. Then add the chopped eels.', 'Stir and bake the eels for 4 minutes. Then pour in the white wine.', 'Let the wine reduce by half and then pour in the fish stock. Season with some pepper.', 'Cover the casserole, keep the heat medium and cook the eels for 5 more minutes until cooked through. Then remove the lid and let the remaining liquid reduce for another 3 minutes (you need some for later as well). Remove the eels from the pan and put them on a clean plate. Drain the cooled greens well and add them to a blender. Then add 3 tablespoons of the eel cooking liquid.', 'Blend well and then add the sorrel.', 'Blend again into a thick green paste. Then add this paste and the rest of unsalted butter to the reduced fish stock in the casserole.', 'Stir well. Add the lemon juice. With a stick mixer blend the green sauce until very smooth. You can also use a blender for this.', 'Check the seasoning of the green sauce and add extra pepper, salt or lemon juice to taste. Then add the cooked eels to the sauce.', 'Stir and scoop the eels in green sauce into bowls. Serve hot.']","['4', '4 people']","['Main Course', 'Starter']",PT60M,PT60M
38,Belgian Braised Endives,PT50M,"['4 fresh Belgian endives', '2 tbsp unsalted butter (diced)', '1 tsp brown sugar', '1 tbsp balsamic vinegar', 'nutmeg', 'pepper', 'salt']","['Rinse the endives and let them drain on a clean kitchen towel. Then trim the reddish bottom part a little and slice the endives lengthwise in half. Season them with a little pinch of pepper, salt and nutmeg.', ""Place the endives cut side down in a dry pan (with a lid). Don't add any butter or oil yet!"", 'Place the pan over high heat and let the endives caramelize for about 5 minutes until they are a little golden.', 'Then add the diced butter and season lightly again with a little pepper, salt and nutmeg.', 'Let the endives bake in the melted butter for 3 minutes. Then pour in a glass of water, sprinkle with the brown sugar and put a lid on the pan.', 'Bring the endives to a rolling boil, then turn the heat to medium-low and braise them for 20 to 25 minutes or until they are very soft and dark brown. Regularly check if you need to add extra water. Shake the pan every once in a while to prevent the endives from burning. In the end carefully flip them over using 2 forks and sprinkle with the (balsamic) vinegar. Add extra water if necessary.', 'Check the seasoning and add extra pepper, salt or nutmeg to taste if necessary. Transfer the endives onto a warm serving dish or divide them over plates. Serve immediately while hot.']","['2', '2 people']",['Side Dish'],PT5M,PT45M
39,Buttermilk Mashed Potatoes (Flemish Karnemelkstampers),PT50M,"['2 tbsp grey North Sea shrimp ((peeled))', '5,5 oz waxy potatoes ((155 g))', '2 tbsp unsalted butter', '¼ cup buttermilk ((60 ml))', '2 tsp sour cream (optional)', '1 tbsp fresh parsley ( or chives, chopped finely)', '1 egg', 'pepper', 'salt']","['Peel the potatoes and chop them into smaller bits. Transfer them to a medium saucepan and fill it with water until they are submerged. Season with a good pinch of salt.', 'Place the potatoes over high heat and boil them until cooked through. Then drain them and add them back to the pan with half of the butter and the sour cream (optional).', 'Mash the potatoes. Then add the freshly chopped parsley or chives, pour in the buttermilk and season with a little pepper and salt.', 'Mash the potatoes again. Check the seasoning and add extra pepper and salt to taste if necessary. Then cover the buttermilk mash and put it aside for now. Fill a pan with water and bring to a gentle boil. Add the egg.', 'Then poach the egg for 4 minutes.', ""This is the classic way to poach eggs. You can also use my cling film method, very easy!&nbsp;In the meantime melt the remaining butter in a small pan until lightly nutty. Don't burn it! Scoop the buttermilk mashed potatoes in a deep plate. Top with the poached egg and sprinkle with the grey shrimp. Drizzle with the melted butter, extra chopped chives or parsley and some pepper and salt. Serve hot.""]","['1', '1 people']",['Lunch'],PT30M,PT20M
40,Kriek Beer Turkey Stew,PT60M,"['2 lbs fresh turkey breast ((900 g))', '1 lb silverskin onions ((450 g))', '5,5 oz salted bacon ((155 g), diced)', '3 cups kriek beer ((720 ml))', '4 garlic cloves (unpeeled)', '1 sprig fresh rosemary', '2 tbsp sour cream', '1 tbsp unsalted butter', 'pepper', 'salt']","['Rinse the turkey breast under cold running tap water and pat it dry using some kitchen paper. Then dice the turkey up into bite-size chunks.', 'Peel the silverskin onions. Then transfer the butter, fresh rosemary and the unpeeled garlic cloves to a large pan non-stick and place this over medium-high heat.', 'Once the butter has melted, add the silverskin onions and the bacon. Then season with a good dash of pepper.', 'Stir for 4 to 5 minutes. Then add the diced turkey.', 'Quickly stir fry the turkey until it is brown on all sides. Pour in the kriek beer.', 'Stir the ingredients well. Then put a lid on the pan and let the turkey simmer for 25 to 30 minutes. Stir regularly. Add extra water or beer if necessary. In the end take the stew off the heat and add the sour cream.', 'Give it all a good stir. Then check the seasoning and add extra pepper or salt to taste if necessary. Remove what is left of the tough rosemary sprig. Scoop the stew onto deep plates and serve hot.']","['4', '4 people']",['Main Course'],PT10M,PT50M
41,Easy Turnip Recipe,PT60M,"['1 ⅔ lbs yellow turnips ((700 g))', '3,5 oz parmesan cheese ((100 g), grated)', '1 tbsp unsalted butter (soft)', 'pepper', 'salt']","['Rinse the yellow turnips and let them drain for a few minutes in a sieve. Cut off the green stems and then peel the turnips. Grate the turnips finely.', 'Put the soft butter on a large oven tray and rub it all over using your fingers (or a piece of kitchen paper if you like).', 'Then transfer the grated turnips to the tray. Try to spread the turnips evenly so that they can cook evenly as well. Season them with a little pepper and salt.', 'Sprinkle the grated turnips with the grated cheese. Then season one last time with a pinch of pepper and salt.', 'Bake the grated turnips in a preheated oven at 392°F (200°C) for 30 to 35 minutes until the cheese has melted and the sides of the turnip au gratin start to brown. Then turn the oven off but leave the turnips inside for another 20 minutes to rest. Remove the turnip gratin from the oven. Cut it up and serve.']","['4', '4 people']",['Side Dish'],PT25M,PT35M
42,Belgian Chicory Rolls,PT120M,"['4 fresh Belgian endives', '4 slices cooked ham', '1 tbsp unsalted butter', '2 tbsp plain flour', '2 cups whole milk ((480 ml))', '1 egg yolk', '2 handfuls grated cheese', 'nutmeg', 'pepper', 'salt']","['Rinse the endives. Remove the little discolored bottom tip. Then place the endives in a pan and add ¼ cup (60 ml) of water.', 'Season with pepper, salt and nutmeg. Cover the pan and place it over medium heat for 45 minutes until the endives are tender. Check regularly. Add extra water if necessary. You can also steam them.', 'Let them cool. Then gently squeeze out any excess water: it makes the bechamel sauce watery. Put a slice of ham on a plate. Place an endive on it and season with some pepper.&nbsp;Roll it up. Make 4 neat rolls.', 'Then transfer the chicory rolls to a baking dish.', 'Melt the butter in a medium saucepan.&nbsp;Then add the flour and whisk. Let the mixture cook for a minute. Stir regularly.', 'Gradually add the milk and whisk constantly over medium heat.&nbsp;The bechamel sauce will gradually thicken.', 'Season it with a little pepper, salt and nutmeg when you’ve added all the milk. Then add the egg yolk and stir.', 'You should end up with a pretty runny but glossy sauce. I also add a few drops of worcester sauce (optional). Pour the bechamel sauce on top of the chicory rolls in the baking dish.', 'Then top with the grated cheese.&nbsp;Bake the chicory rolls in a preheated oven at 400°F (200°C) for about 12 minutes until the cheese crust is golden. Remove the dish from the oven. Divide the rolls over plates and serve.']","['2', '2 people']",['Main Course'],PT60M,PT60M
43,Belgian Blind Finches,PT30M,"['8 thin slices beef', '9 oz ground beef ((250 g))', '1 tbsp unsalted butter', '1 shallot (chopped)', '3 tbsp fresh parsley (chopped)', '1 tbsp garlic (chopped)', 'pepper', 'salt']","['In a saucepan melt the butter and add the chopped garlic and shallots.', 'Cook over low heat for 5 minutes until the shallot is soft. Then put it aside to cool. In a mixing bowl add the beef mince, chopped parsley and cooled shallot and garlic mixture. Season with pepper and salt to taste.', 'Knead the ingredients well. Then taste the beef and add extra pepper or salt if necessary. Divide the mince into 8 even portions. Mine were more or less 1 ½ oz (50 g) each. Put a thin slice of beef on a chopping board and place a portion of the mince in the middle. Sprinkle with a little pepper.', 'Cover with one side of the beef slice.', 'Now fold the other side over the beef. Then wrap the rest of the filling and put the finished parcels on a clean plate.']","['4', '4 people']",['Main Course'],PT30M,
44,Chicken With Port Sauce & Mushrooms,PT45M,"['2 large fresh chicken breasts', '10 white mushrooms (chopped in 4 pieces)', '1 cup cream ((240 ml))', '½ cup red port wine ((120 ml))', 'olive oil', 'pepper', 'salt']","['Pour the red port wine in a medium saucepan and place it over medium-high heat. Cook the port for about 5 to 7 minutes and let it reduce by half. Keep a close eye on it because it goes faster than you might think and you risk burning it.', 'Once the red port has reduced, add the cream to it.', 'Whisk well into a pink cream sauce and season it pepper and salt. Turn the heat to medium-low and simmer the sauce for 8 to 10 more minutes. In the meantime rinse the chicken breasts under cold running tap water and pat them dry using some kitchen paper. Place them on a clean chopping board and cut the breasts lengthwise into 3 to 4 thin slices. Pour a little drop of olive oil in a large non-stick pan, place it over medium-high heat and add the sliced chicken once the oil is hot.', 'Cook the chicken on all sides until browned nicely and cooked through.', 'Season the cooked chicken with a little pinch of pepper and salt. Then take it off the heat and let it rest in the hot pan for now. Add the chopped white mushrooms to the creamy port sauce.', 'Stir well and then check the seasoning. Add extra pepper or salt to taste if necessary. Simmer the sauce for another 2 minutes over medium-low heat.&nbsp;Put the cooked chicken onto warm deep plates. Top with the mushroom and port wine sauce. Add a last sprinkle of freshly ground black pepper. Serve hot.']","['2', '2 people']",['Main Course'],PT10M,PT35M
