,name,total_time,ingredients,instructions,servings,category,prep_time,cook_time
16,"What are maatjes, Dutch new herring or matjesherring?",PT30M,"['2 fat matjesherring (cleaned)', 'a handful green beans', '1 tbsp olive oil', '2 tbsp onion (chopped)', '1 tsp toasted sesame oil', '1 tbsp balsamic vinegar', 'pepper', 'salt']","['1. Trim the green beans and rinse them. Fill a small pan with water, add a good pinch of salt and place the pan over high heat. Once the water is boiling, add the green beans.', '2. Turn the heat lower and cook the beans for a couple of minutes until they are nearly tender, kind of al dente. Don’t overcook the beans. Immediately drain the cooked beans and refresh them under cold running tap water. This will stop the cooking process and will keep the beans bright green.', '3. Place the beans in the fridge to chill for 15 minutes. Then chop the beans up into small bits. Add them to a mixing bowl together with the chopped onion. Season with a pinch of pepper, salt and garlic powder.', '4. Stir the beans well. Drizzle with the olive oil, the toasted sesame oil and the balsamic vinegar.', '5. Stir the beans again. Check the seasoning and add extra pepper or salt to taste if necessary. Place the beans in the fridge for another 15 minutes. Then divide the herring fillets over plates and add the the chilled bean salad. Serve immediately.']",['2'],"['Lunch', 'Salad']",PT20M,PT10M
17,White Asparagus Flemish Style Recipe,PT55M,"['10 thick fresh white asparagus', '3 large hard-boiled eggs', 'a handful fresh parsley', '4 tbsp unsalted butter (melted)', 'pepper', 'salt']","['First peel the asparagus. Place them horizontally on a clean chopping board and hold them with one hand by their heads. Then with your free hand carefully run a vegetable peeler from the heads towards the bottom part. Turn the asparagus as you go until you have removed every inch of the tough skin.', 'Once you have peeled all the asparagus, heck the bottom parts and chop them off if they are dried out. Fill a wide pan with water and bring it to a gentle boil. Then add the asparagus to it and cook them for 7 to 10 minutes (depends how thick they are) until tender. Keep an eye on them!', 'In the meantime peel the hard-boiled eggs and separate the whites from the yolks. Then add the yolks to a clean blender and pulse them well into a fine crumble.', 'Pour the yolks in a cup. Rinse the blender and dry it. Then add the cooked whites to it and blend them as well.', 'Once the asparagus are tender, drain them and divide them over plates. Then garnish the asparagus with the crumbled yolks and whites. Chop up the fresh parsley and divide it over the asparagus. Drizzle with the melted warm butter. Finish with a sprinkle of freshly ground black pepper. Serve warm.']","['2', '2 people']","['Main Course', 'Starter']",PT45M,PT10M
18,Salade Liegeoise Salad Recipe,PT70M,"['12,5 oz potatoes ((350 g))', '7 oz green beans ((200 g))', '2 hard-boiled eggs (peeled and sliced)', '4,5 oz salted bacon ((125 g), sliced)', '2 tbsp onion (chopped)', '3 tbsp olive oil', '2 tbsp white wine vinegar', '1 tsp strong mustard', '2 tbsp fresh parsley (chopped)', 'pepper', 'salt']","[""Scrub the potatoes well, don't peel them. Chop them up into bite-size pieces if necessary. Transfer the potatoes to a large pan and add a generous amount of water and a pinch of salt."", 'Place the pan over high heat until boiling. Cook the potatoes until tender and then remove them using a slotted spoon. Keep the potatoes at room temperature. Trim and clean the green beans. Add them to the pan of hot water you boiled the potatoes in.', 'Cook the green beans until nearly tender (keep them crunchy). Strain and refresh them immediately under cold running tap water to stop the cooking process.', 'Add the bacon to a large non-stick pan and place it over medium heat.', 'Cook the bacon for a couple of minutes until cooked through. Then take the pan off the heat and let the bacon cool down a little.', 'Combine the olive oil, vinegar and mustard. Transfer the cooked potatoes, green beans, bacon, chopped onion, parsley and vinaigrette. Season with pepper and salt.', 'Stir well. Check the seasoning and add extra vinegar, pepper or salt to taste. Transfer the salad to a large serving bowl or 2 deep plates and garnish with the boiled eggs. Serve lukewarm.']",['2'],"['Lunch', 'Salad', 'Side Dish']",PT20M,PT50M
19,Chicken Vol Au Vents,PT180M,"['3 lbs whole chicken ((1,350 g))', '8 medium white mushrooms', '1 small onion (chopped)', '5 medium garlic cloves (peeled)', '1 medium fresh carrot (chopped)', '2 stalks fresh celery (chopped)', '1 sprig fresh rosemary', '3 bay leaves', '4 cloves', '10,5 oz ground veal ((300 g), or ground pork)', '1 egg yolk (beaten)', '2 oz plain flour ((55 g))', '2 oz unsalted butter ((55 g))', 'pepper', 'salt']","['Add the rosemary, garlic, bay leaves, cloves, chopped celery, carrot and onion to a high pan. Season generously with pepper and salt.', 'Cut the chicken up: legs, wings and breasts. Also chop up the remaining carcass. Add it all to the pan. Then fill it with water (I added about 7 cups or 1,7 l) until the chicken is fully submerged.', 'Place the pan over high heat until boiling, then leave it there for 10 minutes. Then turn the heat lower and gently cook the chicken for about 30 minutes. After that take the chicken off the heat and let it cool down for another 45 minutes. In the meantime chop the mushrooms into bite-size pieces.', 'Transfer the pork and veal mince to a bowl and season with pepper and salt. Knead the mince well and make tiny balls of ½ oz (15 g) each. You should end up with about 20 of them. Cover the meatballs with cling film and store them in the fridge until later.', ""Then remove the cooled cooked chicken from the hot stock (don't throw the stock away, we'll make our white sauce with it later). Remove any chicken skin, bones, veins, cartilage or sinew (discard all this) and pick the cooked meat from the bones. Shred the larger bits up roughly. Then transfer the chicken meat to a large pan."", 'Strain the chicken stock in a fine sieve or colander over a large pan. I ended up with 6 cups (1,4 l) of flavorful chicken stock. Discard the cooked vegetables.', 'Then bring the stock to a gentle boil again. Once warm, add the meatballs and mushrooms.', 'Poach them for about 5 minutes. Then remove the meatballs and mushrooms using a slotted spoon. Add them to the shredded chicken.', 'Take the chicken stock off the heat now. In a large saucepan melt the butter over medium heat.', 'Add the flour and whisk well until you get a wet crumble.', ""Gently bake this over medium-low heat for about a minute. Then gradually add splashes of the warm chicken stock until you get a sticky flour paste. Keep stirring. Don't add too much at once or the sauce will become lumpy."", 'Whisk well. Gradually add more chicken stock (about 3 to 4 cups) until you get a pretty runny white sauce. In the end, remove the white sauce from the heat and add the beaten egg yolk.', ""Stir quickly so the yolk doesn't scramble. The sauce will thicken a little extra (this egg yolk technique is called a 'liaison' in French). Check the seasoning and add extra pepper or salt to taste. Then add the white sauce to the chicken, meatballs and mushrooms."", 'Stir carefully. Cover the pan for another 5 minutes and let the vol au vent warm through or place it back over very low heat.', 'Put the vol au vent puff pastry casings onto plates. Top with the chicken, meatballs and mushrooms. Serve the chicken vol au vents hot.']","['6', '6 to 8 people']",['Main Course'],PT60M,PT120M
20,Tarragon Sauce with Beer for Chicken,PT45M,"['2 large fresh chicken breasts (with skin)', '½ cup chicken stock ((120 ml))', '½ cup Belgian dark ale ((120 ml))', '6 sprigs fresh tarragon', '½ cup cream ((120 ml))', '2 tbsp unsalted butter', '1 tbsp olive oil', 'pepper', 'salt']","['Season the chicken breasts on both sides with some pepper and salt. Add the olive oil and half of the unsalted butter to a medium non-stick pan and place it over high heat. As soon as the butter has nicely melted, add the seasoned chicken breasts skin side down.', 'Quickly sear and brown the chicken for about 3 to 4 minutes until the skin is nicely golden. Then flip the chicken over and cook them for another 4 minutes the other side.', 'Then remove the chicken from the pan and place it on an oven tray. Place the chicken in a preheated oven at 356°F (180°C) for 12 to 15 minutes until cooked through.', 'In the meantime place the pan you baked the chicken in back over medium-high heat. Don’t wipe it clean. Pour in the chicken stock and the beer.', 'Bring the chicken stock to a rolling boil and let it reduce for a couple of minutes until half has vaporized. Chop the fresh tarragon up and add it to the pan.', 'Stir and season with a little pepper and salt. Then pour in the cream.', 'Stir well again, turn the heat low and let the sauce simmer for 3 to 4 more minutes. Divide the baked chicken breasts over plates and drizzle with the tarragon cream sauce. Serve hot.']","['2', '2 people']",['Main Course'],PT10M,PT35M
21,Civet de Lievre (Hare Stew),PT210M,"['4 hare legs (or shoulders)', '1 large fresh carrot (slices)', '1 medium onion', '4 large garlic cloves (unpeeled)', '3 cups red wine ((720 ml))', '2 sprigs fresh rosemary', '4 bay leaves', '2 cloves', '2 tbsp black peppercorns', '4 tbsp cranberry jam (optional)', '2 tbsp dried juniper berries', '1 tsp coarse salt']","['Rinse the hare legs under cold running tap water. Pat them dry and place them in a large and wide pan. Sprinkle with the unpeeled garlic cloves, juniper berries and black pepper corns.', 'Then add the sliced carrot, bay leaves and rosemary to the pan. Peel the yellow onion (I used pearl onions that I had still left) and chop it up roughly. Add this to the pan together with a good pinch of salt and the cloves. Pour in the red wine as well.', 'The hare should be fully submerged. Put a lid on the pan and place it in the fridge. Let the hare legs soak and marinate in the wine for at least 12 hour, preferably 24 hours. The hare will look purple after that but that’s normal.', 'Then place the pan over high heat and bring the wine and the rest of the ingredients to a rolling boil. Then turn the heat low and simmer the hare for at least 2 hours until the soft meat falls more or less off the bone. Right in the end stir in the cranberry sauce (optional) or a little brown sugar.', 'Check the seasoning and add extra pepper or salt to taste if necessary. You can add a little bit of flour, cold butter or sauce thickener to make the sauce glossier and creamier. Scoop the hare legs onto deep plates. Divide the carrots and the rest of the sauce over the plates and serve hot.']","['4', '4 people']",['Main Course'],PT30M,PT180M
22,Belgian Chervil &amp; White Asparagus Soup Recipe,PT70M,"['16 fresh white asparagus', '4 cups vegetable stock ((920 ml))', '2 garlic cloves (unpeeled)', 'a handful fresh chervil (chopped finely)', 'a handful grey North Sea shrimp', 'pepper', 'salt']","['Carefully peel the white asparagus using a vegetable peeler.', 'Add all the asparagus skins to a large and high pan together with the whole garlic cloves and add the vegetable stock. Season with a little pepper and salt.', 'Bring all this to a rolling boil and then simmer the stock and the asparagus skins under a lid for 45 minutes. In the meantime chop off the bottom ends of the asparagus (about 1 inch or 2,5 cm).', 'Chop these bits in smaller chunks and soak them in some cold water (or they will change color) until needed later on. Use the peeled asparagus for another recipe (boiled, poached or steamed).', 'Once the asparagus skins have boiled enough, remove them with a slotted spoon together with the cooked garlic cloves and discard.', 'Bring the stock to a light simmer again. Check the seasoning and add extra pepper and salt to taste if necessary. Add the asparagus chunks and chopped chervil', 'Stir well and simmer for another 2 minutes. The asparagus chunks must still be crunchy. Take the pan off the heat and scoop the soup into bowls. Sprinkle with some brown shrimp. Serve hot.']","['4', '4 people']","['Soup', 'Starter']",PT10M,PT60M
23,Belgian Beer & Endive Soup,PT50M,"['2 large fresh Belgian endives', '1 cup Belgian strong ale (tripel) ((240 ml))', '2 cups chicken or vegetable stock ((480 ml))', '1 tbsp unsalted butter', '1 medium garlic clove (chopped)', '3 tbsp onion (chopped)', '1 tsp strong mustard', '1 egg yolk', 'nutmeg', 'pepper', 'salt']","['Add the chopped onion, garlic and butter to a large saucepan and place this over medium heat.', 'Gently fry the onion and garlic in the butter for 5 minutes. Then add the strong ale.', 'Turn the heat high and bring the beer to a good boil. Let it reduce by half and then add the chicken or vegetable stock. Also add the mustard.', 'Then turn the heat lower now to medium again and bring the stock to a light simmer. In the meantime chop the endives up roughly (you can keep some of the yellow tips aside for garnish). Then add the chopped endives to the soup. Season the soup with a pinch of pepper, nutmeg and salt.', ""Stir the soup and then take the pan off the heat. Cover the pan and let the endives poach in the soup for about 5 minutes. Then with a stick blender mix the endive soup for 3 seconds to make it just a tad creamier. Don’t blend it into a smooth soup, keep some texture. If you're using a blender, blend 6 spoonfuls of endives and stock and add it back to the soup."", 'Add the egg yolk.', 'Whisk fast and place the soup over medium heat for another minute. Check the seasoning and add extra pepper, nutmeg or salt to taste. Then scoop the endive soup into large bowls. My favorite garnish: grilled trappist cheese on sourdough bread, a handful of grey shrimp and raw sliced yellow endive tips for extra crunch.']","['2', '2 people']","['Lunch', 'Soup', 'Starter']",PT30M,PT20M
24,Hutsepot,PT130M,"['1 ⅓ lbs floury potatoes ((600 g), peeled and chopped)', '7 oz fresh carrot ((200 g))', '7 oz yellow turnips ((200 g))', '9 oz Brussels sprouts ((250 g))', '7 oz salted bacon ((200 g), diced)', '4 fresh sausages', '1 small onion', '4 large garlic cloves', '3 bay leaves', '3 sprigs thyme', '2 ½ cups chicken stock ((600 ml))', '1 tbsp strong mustard', '1 tbsp unsalted butter', 'pepper', 'salt']","['Add the diced bacon and butter to a large casserole.', 'Place it over medium-high heat until hot. Fry the bacon for 4 minutes. Then add the chopped potatoes, bay leaves and thyme.', 'Stir well. Peel and chop the onion and garlic. Add both to the pan.', 'Stir again. Then add the chicken stock.', 'Cook the potatoes for 5 minutes. In the meantime peel and trim the Brussel sprouts, carrots and turnips. Slice the sprouts in half. Chop the carrots and turnips into bite-size pieces. Then add these vegetables to the potatoes and bacon. Add the mustard and season with pepper and salt.', 'Stir all the ingredients well and then cover pan. Cook the hochepot for 40 minutes until all the vegetables are cooked through. Stir regularly. Add extra water if necessary. In the meantime bake the sausages in a little oil until cooked through.', 'The hochepot is ready when the potatoes start to fall apart and turn it into a mushy vegetable stew. Then check the seasoning and add extra pepper, salt or mustard to taste.', 'Scoop the hutsepot onto plates and top with the sausage. Serve hot.']","['4', '4 people']",['Main Course'],PT40M,PT90M
25,Meatballs In Tomato Sauce,PT150M,"['2 ½ lbs ground beef ((1125 g), or pork)', '5 medium garlic cloves (chopped finely)', '1 large shallot (chopped finely)', '1 medium onion (chopped)', 'a handful breadcrumbs or panko', 'a handful parmesan cheese (grated)', '1 small egg', '3 tbsp plain flour', '2 lbs canned chopped tomatoes ((900 g))', '2 tbsp balsamic vinegar', '1 glass red wine', '2 tbsp worcester sauce', '2 tbsp tomato paste', '1 tbsp caster sugar', 'a handful fresh herbs (chopped)', '1 sprig fresh rosemary', '5 bay leaves', '3 cloves', 'olive oil', 'pepper', 'salt']","['Heat some olive oil in a saucepan until hot. Then add the chopped shallots, half of the garlic and a bay leaf. Season with pepper and salt.', 'Cook the shallot mixture under a lid until browned. Stir regularly. Then take the pan off the heat and let it cool.', 'Pour the mince in a large bowl. Add the cooked shallots (remove the bay leaves) and egg.', 'Knead the mince. Then add the panko (or breadcrumbs) and grated parmesan. Season with pepper and salt.', 'Knead the mince well. Add extra pepper or salt to taste. Then make meatballs from the mixture. Mine were about 1 ½ oz (45 g). In the end I had 30 meatballs.', 'Coat the meatballs lightly with the flour. In a large casserole pour some olive oil and place it over high heat until hot. Then add the meatballs.', 'Brown them on all sides for 6 minutes.', 'Then remove them from the pan, keep the oil. Turn the heat lower and add the remaining bay leaves, rosemary, chopped onion, cloves and the remaining garlic.', 'Gently fry the onion for about 4 minutes. Then add the chopped tomatoes, tomato paste and sugar.', 'Stir well. Then add the red wine, balsamic vinegar and worcester sauce. Season with pepper and salt.', 'Bring the tomato sauce to a rolling boil and then turn the heat low. Simmer the sauce under a lid for 30 to 40 minutes. Stir regularly. Then blend or mix the sauce until very creamy.', 'Check the seasoning and add extra pepper or salt to taste. If the sauce is too bitter or vinegary, add an extra pinch of sugar to reduce that flavor. Stir in the chopped herbs.', 'Add the browned meatballs.', 'Cover and cook for 10 minutes until the meatballs are warmed through. Then scoop the sauce and meatballs onto deep plates. Serve hot.']","['6', '6 people']",['Main Course'],PT90M,PT60M
26,Pork Chops In Beer & Bacon,PT55M,"['2 fresh pork chops', '2,5 oz salted bacon ((70 g))', '1 small onion (chopped)', '1 tbsp plain flour (or cornstarch)', '2 tbsp unsalted butter', '1 cup Belgian strong ale (tripel) ((240 ml))', '1 tbsp strong mustard', 'pepper', 'salt']","['Slice the bacon into strips. Season the pork chops with a pinch of pepper and salt on both sides.', 'Place the butter in a non-stick pan over medium heat until foaming. Then add the seasoned pork chops.', 'Quickly sear the chops for 3 minutes on both sides until brown.', ""Transfer them onto a clean plate and cover with tinfoil. Put them aside until needed later. Then add the diced bacon to the same pan you browned the pork in. Don't discard those lovely juices!"", 'Stir fry the bacon for 2 minutes over medium heat. Add the chopped yellow onion.', 'Cook for 4 minutes more. Pour in the brown beer and stir well.', 'Season with a little pepper and salt to taste. Cook the onion and bacon for 2 minutes. Sprinkle with the flour or cornstarch and also add the mustard to the beer sauce.', 'Stir and cook for 1 minute. Then transfer the browned chops you put aside back to the pan.', 'Put a lid on the pan and simmer the chops for 4 to 5 minutes until warmed through. The beer sauce should have thickened a bit. Check the seasoning and add extra pepper, salt or mustard if necessary. Put the pork chops onto warm plates and drizzle with the beer sauce. Serve.']","['2', '2 people']",['Main Course'],PT10M,PT45M
27,Belgian Meatballs with Sour Cherries,PT90M,"['12,5 oz meat mince ((350 g))', '1 tbsp breadcrumbs or panko', '1 tbsp parmesan cheese (grated)', '2 small garlic cloves (chopped)', '1 small egg yolk', '1 small shallot (chopped)', '2 stalks fresh celery (chopped)', '9 oz canned sour cherries and juice ((250 g))', '1 tsp cornstarch', '2 tbsp unsalted butter', '2 bay leaves', 'pepper', 'salt']","['Add the chopped shallot, the bay leaves and half of the garlic to a saucepan.', 'Add a teaspoon of butter. Place this over medium heat and fry the shallot and garlic for 8 minutes until soft and golden. Then season with a pinch of pepper and salt.', 'Then take the pan off then eat and let this mixture cool. Transfer the mince to a mixing bowl. Add the cooled onion (remove the bay leaves) and egg yolk.', 'Stir and add the breadcrumbs (or panko) and grated parmesan. Season with some pepper and salt.', 'Stir well again. Check the seasoning and add extra pepper or salt to taste. Then roll even balls from the mixture. Mine were 1 oz (30 g). I had 16 meatballs in the end. Melt half of the remaining butter in a non-stick pan and add the meatballs.', 'Place the pan over medium-high heat. Brown the meatballs on all sides for 4 minutes until golden. Then cover the pan with a lid, turn the heat lower and let the meatballs cook for 10 minutes until cooked through.', 'Shake the pan regularly. Add extra butter or olive oil if necessary. 5 minutes before the meatballs are done, pour the sour cherries and their juice in a medium saucepan and place it over medium heat.', 'Pour 5 tablespoons of cherry juice in a cup and add the cornstarch.', 'Stir well. Once the cherries in the pan are warm, add the starch mixture.', 'Keep stirring until the sauce starts to thick. Scoop the meatballs onto deep plates. Drizzle with the cherrie sauce. Serve hot.']","['2', '2 people']",['Main Course'],PT45M,PT45M
28,Belgian Sugar Pie Recipe,PT20M,"['7 oz self-raising flour ((200 g))', '3 oz unsalted butter ((85 g), ice cold and diced)', '1 egg yolk', '¼ cup whole milk ((60 ml), tepid)', '1 tbsp caster sugar']","['Add the self-raising flour and diced cold butter to a blender. Season with a tiny pinch of salt and the caster sugar.', 'Pulse into a dry mixture. Then add the egg yolk and tepid milk.', 'Pulse again until the dough comes together nicely. It shouldn’t be sticky at all.', 'Then transfer the dough to a lightly floured surface and knead it for 3 minutes. Wrap it in a sheet of cling film and put it aside to rest for at least 30 minutes.']","['6', '6 people']",['Dessert'],PT20M,
29,Belgian Mussels with Blue Cheese &amp; Tripel Beer,PT40M,"['14 fresh mussels', '½ cup Belgian dark ale ((120 ml))', '2 oz blue cheese ((55 g), crumbled)', '1 small garlic clove', '3 tbsp fresh carrot (diced)', '3 tbsp fresh celery (diced)', '2 tbsp onion (chopped finely)', '2 tbsp fresh parsley (chopped finely)', '1 tsp unsalted butter', 'pepper']","['Rinse the mussels under cold running tap water. Brush them clean and scrape off any sediments on the shells using a sharp knife. Then rinse the mussels again and let them drain at room temperature.', 'Peel the garlic clove and chop it up very finely. Add the unsalted butter to a medium saucepan and add the chopped garlic.', 'Place the pan over medium heat and gently fry the garlic in the melted butter for 2 minutes. Then add the diced carrot, celery and yellow onion to the pan as well. Season with a little pinch of pepper.', 'Stir the vegetables well and cook them in the butter for about 6 minutes. Then pour in the tripel beer.', 'Stir and cook for another 2 minutes. Then add the cleaned and rinsed mussels to the pan.', 'Stir and put a lid on the pan. Turn the heat high now and let the mussels cook in the beer and vegetables for 4 to 5 minutes. They should have opened by then. Add the crumbled blue cheese.', 'Stir, turn the heat lower and let the blue cheese melt into the beer sauce. Cook for another 2 minutes until the sauce starts to thicken lightly.', 'Check the seasoning and add extra pepper to taste if necessary. Then scoop the mussels onto warm plates and drizzle with the rest of the blue cheese sauce and vegetables. Sprinkle with some of the freshly chopped parsley. Serve immediately while hot.']","['2', '2 people']","['Appetizer', 'Starter']",PT20M,PT20M
30,Easy Ham And Leeks Rolls,PT120M,"['12 slices cured ham', '12 slices Emmental cheese', '2 lbs fresh leeks ((900 g))', '1 tbsp unsalted butter', '1 cup whole milk ((240 ml))', 'a handful grated cheese', '1 tbsp plain flour', 'nutmeg', 'pepper', 'salt']","['Trim and rinse the leeks. Then chop the leeks into 12 to 16 even pieces about 3 inches (7,5 cm) in length.', 'Then steam the leeks. I used a pasta pan, placed the leeks on the bottom of the basket and then added an inch (2,5 cm) of water.', 'Bring the water to a boil over medium-high heat. Then steam the leeks for 30 minutes until soft.', ""You can also prepare them in a steam basket or steam oven. If you can't steam, then boil the leeks.Then let the leeks cool down fully. Gently squeeze them to remove any excess water, or the sauce will be too runny in the end. Melt the butter in a saucepan."", 'Then add the plain flour and whisk well.', 'Let the mixture bake for a minute to get rid of the floury taste. Then pour in the milk little by little. Whisk constantly over medium-low heat.', 'The bechamel sauce will thicken as you go.', 'Season it with pepper, salt and nutmeg in the end. You should end up with a pretty runny sauce. Make the leek rolls now. Top a slice of ham with a slice of cheese and a cooked leek. Season with pepper.', 'Roll the leek up. Place it in a large baking dish and assemble the remaining rolls. Arrange them neatly in the dish.', 'Pour the bechamel sauce on top. Then sprinkle with the grated cheese.', 'Grill the leeks under a hot grill for a couple of minutes until the cheese has melted. Serve hot.']","['4', '4 people']",['Main Course'],PT60M,PT60M
